uur_id,project_id,medewerker_id,datum,uren,omschrijving
3774,83,3,2024-05-05,1.5,Rijst vertrekken vergelijkbaar noot deken.
3775,81,3,2024-05-05,3,Afhangen kijken conditie koud zinken open.
3776,15,5,2025-02-27,1.5,Natuurlijk pistool grijs.
3777,76,3,2026-01-20,6,Seconde schieten aanval dus.
3778,90,6,2025-04-30,8,Miljoen vroeger verstoppen hoe.
3779,131,7,2024-09-24,2,Rubber plank lang waarschijnlijk beroep begrijpen.
3780,68,2,2024-03-26,7.5,Foto blazen knippen.
3781,144,6,2023-02-07,1,Herinneren herfst vies.
3782,22,6,2023-12-09,2,Nummer vergissen gevaar start.
3783,84,6,2026-01-29,4,Iedereen gezond heel helft chocolade eenheid.
3784,84,3,2023-11-17,2.5,Gif bos wens stoffig rijzen wakker.
3785,79,5,2025-06-05,6.5,Thuis meer geboorte kaart.
3786,145,4,2025-10-17,1,Nieuw stom schrijven.
3787,120,6,2023-12-02,8,Laag week vet meel boerderij.
3788,134,8,2023-10-30,2.5,Ziek want bezoek.
3789,117,6,2023-09-28,6.5,Acht jullie kind god.
3790,136,1,2025-04-12,2,Tekenen neus bieden feit plafond.
3791,13,6,2023-08-17,3,Tellen kast dorp bruiloft nul hoop.
3792,18,1,2023-11-09,8.5,Uur beide ook help volgende trein.
3793,11,1,2025-01-22,3,Wakker ziel ochtend.
3794,37,2,2023-11-08,4,Houden vaak verhaal zij breken.
3795,134,4,2024-09-25,2.5,In plaatje fles examen verspreiden.
3796,90,4,2023-09-03,4,Gaan net wreed bloed voorzichtig tas.
3797,65,7,2026-03-20,7,Zuid zeep berg.
3798,144,3,2025-12-19,8,Vierkant eerste cadeau park.
3799,57,7,2023-03-13,2,Heuvel dik scherp vlieg.
3800,114,3,2024-12-09,3,Maan verjaardag zitten verliezen verhoging steen.
3801,142,4,2023-02-24,6,Drinken morgen diep.
3802,103,4,2024-12-05,2.5,Hard zou hard kort.
3803,45,8,2024-04-25,2,Gereedschap huis prinses kantoor.
3804,51,1,2024-04-09,7,Woord hoewel baan.
3805,67,6,2024-08-11,3.5,Vaarwel hart lip.
3806,123,7,2024-04-06,2,Blauw sluiten vork piano volgorde krant.
3807,10,8,2023-06-28,6.5,Nu rekenmachine hier lucht steun slapen.
3808,133,1,2025-03-24,1,Storm hemel zoon help.
3809,145,2,2025-11-13,2.5,Steun echt orde dan wij vertellen.
3810,60,7,2025-11-01,8,Glimlach dichtbij lach sap west wanneer.
3811,143,2,2023-03-21,1,Alleen ziel wanneer.
3812,103,4,2023-11-16,4,Zoet klein persoon afname vos.
3813,26,8,2026-02-17,7,Potlood doen geschikt u buren niet.
3814,79,7,2025-06-09,7.5,Veilig week deze bijzonder vak.
3815,128,5,2025-09-06,2.5,Weg kost raam kleren pistool.
3816,65,3,2023-09-26,2,Wreed angst eigen goud ontvangen.
3817,32,5,2023-10-18,2,Stof activiteit ontsnappen.
3818,46,3,2024-06-03,2.5,Reizen positie wat.
3819,118,1,2024-01-01,7.5,Middel tafel nummer lot signaal.
3820,64,6,2025-02-11,2.5,De bedekken product maan.
3821,140,4,2023-04-11,4,Olie persoon steen gevaarlijk.
3822,16,5,2023-05-17,8,Of wijn dat jagen.
3823,83,2,2025-03-23,7.5,Huren vreemd vakantie huilen.
3824,93,4,2024-04-28,1.5,Vogel uitleggen alles welkom waarom wissen.
3825,95,3,2026-02-18,3,Afhangen klein haast andere traan.
3826,67,7,2023-01-28,7,Gif ladder kaas heet.
3827,149,5,2023-12-24,4,Gisteren wreed kop zo zes bal.
3828,107,7,2025-03-28,2.5,Alles vijver positie zien opa houden.
3829,139,1,2023-05-10,3.5,Zeggen gewoon auto vreemd hotel.
3830,20,3,2025-01-10,3.5,Leiden controle moorden middel mogelijk.
3831,124,5,2023-05-18,3,Liefde voedsel ja schreeuw vuur perfect.
3832,97,7,2023-05-28,1.5,Bewegen koers zand lach.
3833,110,4,2024-07-10,1,Vol daarom orde.
3834,145,6,2026-04-25,3.5,Zuid tweede vijand.
3835,1,3,2024-01-14,1.5,Kleur wat meerdere opnemen repareren liniaal.
3836,126,3,2023-02-07,3,Student persoon fit.
3837,28,3,2023-01-31,1.5,Falen buiten soms.
3838,20,4,2023-07-03,2.5,Versturen naar tuin tas.
3839,118,8,2026-03-16,2.5,Om wolk ontbijt herinneren.
3840,118,1,2025-12-25,6.5,Slot bureau lunch onderwerp bedreiging kant.
3841,65,2,2026-03-05,6.5,Lichaam om opleiding voet.
3842,141,4,2023-12-04,4.5,Map prijs vast huilen gat.
3843,38,8,2023-06-13,8,Midden vaak gevangenis moment muziek.
3844,133,6,2025-03-08,7,Neer tegen vergelijken huilen scheiden delen voorkomen.
3845,122,6,2026-03-27,6.5,Televisie wijn neus één vol.
3846,92,4,2024-04-30,8,Vrijheid snel vreemde tafel breken fris.
3847,111,6,2023-08-25,6,Kind bal vragen moorden.
3848,150,6,2024-09-24,2,Niet hebben willen lang vrijheid.
3849,43,1,2024-01-08,2,Mits pen kop honger nummer meel.
3850,103,1,2023-11-21,1,Station onze verdrietig map.
3851,82,5,2024-12-15,4.5,Bij kaart enkele.
3852,85,8,2026-02-27,7.5,Honderd ik toekomst hotel plein water.
3853,1,3,2023-01-15,7,Mes nieuw lui grijs zes benzine.
3854,116,5,2025-05-11,6.5,Ziekenhuis kloppen volgorde welke.
3855,145,7,2024-09-25,6.5,Liegen tafel verhaal radio toename.
3856,131,5,2024-09-01,6.5,Midden gevolg gebied perfect jullie hoeveel.
3857,112,6,2023-07-02,4,Terugkomst leren volgende peper lichaam.
3858,78,6,2025-05-23,7,Leeftijd wetenschap aardig vaarwel oneven extreem.
3859,75,6,2023-03-09,1.5,Vannacht bellen breken tien vergeven binnenkort.
3860,138,4,2024-10-06,7,Oog raken dier wassen dat.
3861,82,7,2023-03-19,6.5,Groep nodig stof hemel reizen dorp.
3862,22,2,2024-01-17,4.5,Kuil bedreven plein taxi leren.
3863,41,7,2026-03-04,7.5,Wreed uitvinden vlag.
3864,14,6,2024-04-01,3,Gras trein eis.
3865,52,6,2026-04-30,4,Oceaan betalen verstand vijver.
3866,48,8,2024-12-17,1,Stom kip voelen kop zonnig.
3867,124,5,2025-04-26,7,Bot in gezond lach afhangen genieten.
3868,87,6,2024-04-25,1.5,Voorzien bad voorkomen.
3869,120,7,2025-03-16,3.5,Verstoppen wereld veilig kost schudden mijn.
3870,80,5,2024-05-22,3.5,Plus storm komen.
3871,20,5,2024-03-29,3.5,Plant belofte paar dienen.
3872,75,5,2023-09-06,4,Vechten jagen liggen plat ruimte uitnodigen.
3873,85,4,2024-07-18,6.5,Stem dragen binnenkort voelen kaart.
3874,80,1,2026-03-23,3.5,Soort verrassen raak rechts offer.
3875,43,4,2025-12-12,8,Ring lopen vlag.
3876,146,7,2023-04-08,6.5,Daarom waarschijnlijk klopt lach fout partner.
3877,65,5,2023-09-20,6.5,Me mond haast komen lijk.
3878,31,1,2023-07-24,2,Tennis alleen meer ijzer rest vork.
3879,17,3,2026-03-15,4,Wij partner benzine meisje keus dienen.
3880,13,8,2023-08-24,8.5,Hebben trein papa doorzichtig.
3881,56,5,2024-10-31,3.5,Rijzen leeuw grens nodig.
3882,138,3,2025-04-25,3.5,Taart taart muziek probleem reizen markeren.
3883,3,1,2023-09-15,1,Liggen jas test oost avond.
3884,90,7,2024-09-10,3.5,Kant helft per.
3885,15,1,2023-05-12,2,Presenteren hemel zomer leiden.
3886,32,3,2023-10-17,7.5,Rechtvaardig bord vertrouwen u drogen dak.
3887,98,7,2023-08-24,2.5,Verdrietig glas per.
3888,55,6,2024-12-30,6.5,Mengsel winter schip.
3889,1,7,2026-04-07,3.5,Vier in kamer maan.
3890,19,5,2023-06-11,6,Zullen rekenmachine breed.
3891,55,5,2025-01-08,6.5,Proberen maaltijd vertrekken taxi periode.
3892,67,2,2024-11-01,4.5,Geluid betalen vorm gif.
3893,14,4,2023-05-29,2.5,Meisje drijven willen maken mis kort.
3894,119,3,2024-08-30,2,Gebeurtenis goud zes.
3895,56,5,2023-10-05,1,Hert koken horen punt machine plaat.
3896,80,7,2025-07-25,3,Deze verwachten niets zes jagen.
3897,5,5,2024-03-01,7,Vergelijkbaar rok oost.
3898,121,7,2024-04-20,7.5,Meneer overleden verf kantoor missen.
3899,10,6,2026-01-11,8,Kost dier vraag nek vrouw.
3900,111,1,2023-10-16,6.5,Prins tennis kuil gelijk steun rechtdoor zeggen.
3901,142,8,2023-11-10,8,Liggen heet maar gespannen.
3902,80,4,2024-08-08,1.5,Zwak liggen snel gevaarlijk zo richting.
3903,94,1,2023-03-18,3,Sok uur schip zijn bus jagen.
3904,14,3,2023-11-14,2.5,Ontmoeten zullen na foto wij.
3905,123,7,2023-11-28,8.5,Smaak kost bureau alsjeblieft pas.
3906,99,3,2024-11-23,2.5,Boos bibliotheek ja rook reeds.
3907,46,4,2024-02-12,2,Suiker leven auto.
3908,40,6,2023-01-20,2,Maag totaal goedkoop appel noemen.
3909,65,4,2025-04-01,6,Dubbel negen hij boom vriendelijk dik.
3910,67,4,2023-01-21,2,Oom test rennen tegen water.
3911,127,2,2024-06-03,4.5,Lijk rood jong elektrisch leerling.
3912,132,6,2023-09-09,7.5,Kennis ring kaars nee.
3913,42,8,2023-01-22,4.5,Bed beide chocolade netjes fit.
3914,76,1,2024-12-12,8.5,Zetten gedrag in.
3915,63,1,2023-12-22,3.5,Student per bewegen.
3916,79,8,2023-06-10,2,Bedreiging maken vertellen door.
3917,65,5,2023-12-16,2,Zilver geboren kraam rijzen.
3918,88,8,2023-09-27,1,Hij sluiten sport laat.
3919,27,8,2023-05-20,8,Wolk goed zeil.
3920,87,1,2023-11-30,2,Signaal verstand voorzichtig activiteit.
3921,120,5,2025-02-03,1.5,Waarschijnlijk ring gebruikelijk.
3922,139,8,2026-01-24,4,Televisie les kast vals koers.
3923,120,2,2024-10-19,8.5,Moord zijn ijs.
3924,80,1,2026-05-15,8,Geliefde springen vader winnen slapen.
3925,127,3,2025-03-02,3,Dan moeilijk tand.
3926,99,2,2025-08-18,7,Leeuw op blazen buurvrouw chocolade.
3927,12,6,2024-01-04,2.5,Trui doos gisteren rechtvaardig.
3928,78,3,2025-02-28,4.5,Vierkant uitzoeken bijvoorbeeld brandstof met.
3929,55,8,2024-05-21,4,Ons zitten verkeerd vak vier kom.
3930,54,2,2026-03-20,8,Lomp glad plus klas kijken.
3931,14,2,2023-09-24,1,Dus schaar hoek haan.
3932,72,6,2025-12-23,4,Breed boom tekenen.
3933,20,8,2026-02-06,4,Repareren tante schouder binnenkort kleur list.
3934,87,1,2023-04-12,8.5,Zes schaduw dat extreem ver proberen.
3935,103,2,2024-04-06,6,Schetsen foto vergeven.
3936,103,3,2026-04-18,6.5,Mooi test nieuw vraag verwijderen.
3937,144,2,2026-05-10,3,Gezicht rijk doorzichtig.
3938,144,7,2023-12-20,2,Gezond naast elk.
3939,132,3,2024-06-05,2,Glimlach bel boom een draad.
3940,87,3,2023-12-01,1.5,Vuur activiteit aanbod meerdere.
3941,52,7,2023-10-23,1.5,Warm maken meest stap actief.
3942,111,4,2024-10-18,7.5,Reiken meisje brandstof nog tellen.
3943,57,4,2024-02-04,7,Dat pan aanraken land meest.
3944,128,1,2024-08-16,3.5,Potlood één bodem.
3945,149,6,2024-09-16,6.5,Bal nooit verleden.
3946,6,3,2023-01-25,3.5,Om rechts borstelen koers onze.
3947,110,6,2023-01-22,8.5,Geboren verandering dom.
3948,55,8,2023-05-27,6.5,Recht trouwen geven leeuw.
3949,116,7,2025-10-14,3,Breed per kort honderd.
3950,121,4,2024-03-04,2.5,Passeren al tien geschikt.
3951,145,8,2024-07-02,2.5,Appel onderzoek sleutel mengsel afhangen hebben.
3952,47,6,2024-10-15,8,Van zwembad sinds overeenkomen ruimte.
3953,122,2,2026-03-07,2,Object stem kind.
3954,42,3,2025-03-28,3,Boord koningin nood oor maand actief.
3955,47,3,2023-02-26,7.5,Dromen zeep wat beroemd.
3956,20,6,2026-04-28,3,Praten koningin daarom vlag.
3957,45,6,2025-04-20,2,Kort aanval drogen langs.
3958,71,7,2024-10-08,8.5,Nul moment kat.
3959,119,3,2024-05-15,4,Moorden dan verkopen pan.
3960,12,7,2024-08-30,7,Tekenen kennis gedrag model.
3961,79,1,2025-02-11,1.5,Ei verhaal presenteren aap.
3962,56,4,2026-02-02,3,Links vol hoogte binnen heuvel.
3963,13,5,2023-08-08,2,Klas fout schetsen in.
3964,47,2,2026-03-21,6,Vlieg station hem.
3965,28,3,2023-06-21,2,Derde nog eerste.
3966,149,2,2023-06-06,3.5,Houden moord positie slaapkamer ongeluk activiteit.
3967,126,7,2025-02-01,6,Ieder taal pagina boord.
3968,89,1,2026-01-02,4.5,Bijten meneer altijd antwoorden kuil lomp.
3969,96,5,2023-08-01,8,Vork help cirkel.
3970,113,5,2026-02-13,6,Aap bodem kok noch gedragen.
3971,1,1,2024-09-17,8,Oefening hoewel geloof kloppen gewicht succes lopen.
3972,128,8,2025-03-06,2.5,Lui vier leren belangrijk knie.
3973,96,7,2024-05-15,8.5,Het wild rechts smal.
3974,92,2,2025-04-02,3.5,Tweede lot postzegel verkeerd verkeerd prijs.
3975,65,5,2026-05-05,4,Tafel basis geboorte glad traan stop.
3976,126,3,2024-01-05,1,Hun studie minuut zoals zullen.
3977,53,1,2024-01-02,1,Brug aan noemen vouwen vertrekken.
3978,13,5,2024-09-17,7,Help vis leven uit verkopen nodig.
3979,65,2,2023-12-01,6.5,Knie versturen verleden donker beest.
3980,149,2,2024-07-30,7.5,Terwijl op wijn vanmorgen snijden hebben.
3981,46,7,2023-07-04,4.5,Laag bruikbaar branden melk zulke mand.
3982,28,3,2026-04-19,6.5,Voelen kantoor ring jij.
3983,33,1,2025-11-18,7,Maal mond totaal deze knie.
3984,123,7,2023-04-27,2.5,Feit moeilijk goed zorg als eten.
3985,1,1,2023-02-12,7,Pas gevolg schaap.
3986,48,6,2023-01-12,3,Vertrekken steun activiteit lengte sorry spreken.
3987,55,2,2024-02-01,6.5,Wat woud snelheid krant.
3988,96,3,2023-01-08,3,Naald wereld tevreden markt.
3989,1,6,2024-07-07,2,Te liefde lichaam lucht overeenkomen maken.
3990,121,3,2026-02-06,7,Ontbijt vork kracht klaar.
3991,17,8,2026-03-02,8,Maken echt stof taal liggen rijk.
3992,48,8,2025-03-26,6.5,Begrip leuk gelijk.
3993,52,4,2025-06-12,2,Buren oceaan laken eenheid tram.
3994,62,4,2025-10-24,6.5,Nobel vreemde wakker haar dood.
3995,148,6,2025-09-17,4,Sap tennis beest dapper.
3996,52,7,2023-08-22,7.5,Opnemen gebruiken groente alleen kort slecht.
3997,126,5,2025-07-20,1,Vergelijken wonder klas.
3998,55,3,2023-08-11,1,Slapen rubber aanraken peper.
3999,60,4,2025-11-01,8,Eeuw leuk voeden.
4000,102,3,2023-11-09,1,Terugkomst overvallen blijven moeder gemak.
4001,140,6,2025-08-02,7,Appel kleur wijs.
4002,144,7,2023-02-10,4.5,Nemen verder huur nemen.
4003,123,6,2023-07-14,7,Genieten brug oom student tweede.
4004,29,5,2026-04-06,2,Gevangenis kantoor zeil.
4005,37,8,2024-05-21,8,Negen aarde genot.
4006,133,2,2025-06-29,4,Kuil zulke ziekenhuis kasteel u.
4007,76,5,2024-12-22,6.5,Offer ziekenhuis langzaam nek zeep nood.
4008,52,1,2024-12-17,7.5,Rots bang soort.
4009,110,6,2023-11-05,7.5,Draad gereedschap bewolkt.
4010,50,6,2025-03-28,6.5,Arm vrede plaats snelheid hoogte kort.
4011,41,6,2026-03-23,8,Wat wonder tellen reiken nobel.
4012,148,3,2025-07-06,2.5,Oneven tennis dochter vol min veranderen.
4013,82,7,2024-12-04,3,Gespannen ding hert.
4014,89,3,2023-01-19,8.5,Tuin drinken vanmorgen manier rest.
4015,128,5,2026-04-01,8,Hert broek acht eiland duwen.
4016,123,5,2025-08-31,2.5,Moeilijk man afval bieden bal nee.
4017,116,8,2023-05-09,8.5,Ieder bij wij deken.
4018,133,5,2023-02-14,6,Staal rechts aanval sorry.
4019,85,7,2025-10-16,3.5,Kans kat graf koorts negen plaat.
4020,148,5,2024-07-18,1,Begrip voor kraam.
4021,75,5,2023-08-19,4.5,Vlag hoeveelheid ster.
4022,62,7,2025-07-27,6.5,Jullie kraam rubber.
4023,111,5,2026-04-05,6,Geur dragen beer vies koorts.
4024,80,5,2026-04-11,6,Neus te hallo noemen wij eenzaam.
4025,150,7,2024-10-09,1,Ontvangen kijken woord.
4026,35,1,2023-01-21,3,Vriend scheiden foto.
4027,133,1,2023-12-02,4,Slapen actief bedreven blauw gewoon lijk.
4028,17,1,2025-03-23,4.5,Dienen controle meneer god rekenmachine ijs.
4029,77,6,2026-01-19,2.5,Plaatje maag boerderij.
4030,1,4,2025-12-01,1,Soort oneven miljoen.
4031,91,4,2023-03-26,3.5,Richting ander cirkel bevatten comfortabel bruin.
4032,80,2,2026-05-03,7.5,Diep sorry jong gelijk sinds ziek.
4033,72,1,2026-02-07,3.5,Verjaardag verenigen oog vers student.
4034,4,1,2023-11-02,4.5,Iemand dom vrouw ijzer zeker politie.
4035,101,7,2023-01-02,2,Waarschijnlijk vak bibliotheek verkeerd uitleggen.
4036,62,1,2025-04-05,1.5,Bijzonder pad zij vriezen maat.
4037,28,5,2025-01-02,4.5,Helft vertrouwen zullen zeil waarschijnlijk.
4038,88,7,2026-03-03,2.5,Oma machine gelijk kunst.
4039,146,8,2025-07-08,6,Comfortabel pad muziek nooit schip.
4040,138,3,2023-02-09,7,Heet oog zingen traan.
4041,9,2,2025-04-28,7,Sport geit we lepel toename meer.
4042,36,1,2024-02-22,4.5,Haten postzegel elektrisch voetbal.
4043,90,5,2024-04-17,3.5,Plafond maaltijd mijn pan.
4044,114,8,2023-09-27,6,Kant breken vriezen structuur verschil.
4045,123,7,2024-07-15,7.5,Vorm vierkant publiek vergelijken.
4046,11,7,2025-02-05,2.5,Wachten bedekken uur goud netjes afspraak.
4047,34,6,2023-10-18,8,Buurman mama vet zeer.
4048,140,3,2024-12-05,6.5,Angst been haar pad ladder jouw gebruikelijk.
4049,54,3,2024-10-07,4,Cadeau vloer kraam school ziek.
4050,97,4,2023-09-13,6,Buurman gezond dienen.
4051,127,1,2024-03-17,7.5,Gaan tevreden gedrag.
4052,140,7,2024-06-13,4.5,Tafel snelheid goed verdrietig zijn waar.
4053,96,6,2024-09-13,6.5,Deksel geluk winkel broer maag.
4054,96,3,2026-05-08,2.5,Koning vuur gewicht zeep.
4055,68,6,2023-07-17,8,Land ziek ademen activiteit berg.
4056,41,5,2023-01-13,4,Buurman pen gebeuren zitten.
4057,65,2,2024-11-13,7.5,Nee stelen links hen ding nieuws.
4058,1,4,2023-12-07,7,Vergelijken zeggen publiek honger.
4059,27,2,2025-03-18,2,Sap vuur meerdere markt west.
4060,134,8,2025-08-25,2,Gereedschap overal toename doos teen.
4061,76,6,2023-11-18,4.5,Steun maand terwijl kost.
4062,96,3,2026-02-12,3.5,Bang erg papier.
4063,50,6,2024-01-06,6.5,Onze signaal potlood.
4064,29,7,2023-10-14,7.5,Heet lopen beroep verhoging heuvel.
4065,143,6,2023-08-25,6.5,Lomp mes verkeerd.
4066,16,6,2023-06-22,4,Hoeveel redden beetje wassen droog.
4067,106,5,2023-04-17,6,Bus plaat overvallen speciaal.
4068,130,8,2026-05-12,1.5,Station liefde kap.
4069,70,6,2024-09-21,3.5,Winter gebied eis zaak.
4070,89,8,2024-03-15,3,Kopen afval hoeveelheid fijn terug opnemen.
4071,33,8,2025-12-19,7.5,Traan scheiden drogen maken.
4072,133,4,2023-09-01,3.5,Huren elk verandering ver.
4073,11,6,2024-06-16,3,Voorzichtig genoeg west.
4074,67,4,2024-04-18,4,Groeien gerecht vragen roze.
4075,122,2,2023-09-13,6,Dus gedrag het.
4076,74,3,2023-05-21,7,Dichtbij taal werk algemeen.
4077,148,3,2025-05-24,1.5,Nieuws eeuw vannacht ding geluk instrument.
4078,51,8,2026-02-14,1.5,Wachten kop buurman vechten hoogte.
4079,3,5,2026-01-17,4,Mensen blij wissen.
4080,93,2,2026-02-10,4,Neus minder uitnodigen zacht glimlach.
4081,128,5,2024-10-03,2,Grappig dichtbij publiek.
4082,96,4,2025-04-16,3,Winter koken betalen ouder.
4083,29,2,2025-09-15,8,Kiezen kijken blauw hoewel.
4084,55,5,2024-12-30,4.5,U auto mengsel munt open verlaten.
4085,145,2,2024-07-25,8.5,Vriendelijk jagen stil springen het.
4086,48,7,2025-09-08,4.5,Wereld zijn piano vlag.
4087,68,4,2026-04-20,1.5,Hun min succes.
4088,110,7,2025-03-22,2.5,Miljoen buiten wereld lenen gedrag.
4089,9,1,2024-06-20,3,Politie compleet groeien genoeg verhaal leger.
4090,140,4,2023-08-18,1.5,Controle verschrikkelijk rijst vinger rechtvaardig.
4091,100,3,2026-03-28,1,Geliefde compleet vlag aan leren.
4092,119,5,2023-07-14,7,Hier hal begrijpen.
4093,113,5,2024-08-11,2.5,Onder kloppen vaarwel restaurant lamp lijk.
4094,133,6,2025-11-19,8.5,Hen schaap schijnen.
4095,143,6,2025-06-16,2.5,Alles werk bang tas avondeten.
4096,33,1,2026-03-15,3,Bieden grootmoeder studie.
4097,127,8,2024-01-02,2,Verrassen stap paar.
4098,41,5,2026-01-08,6,Verenigen nat offer nieuw falen grof.
4099,131,2,2025-12-19,6,Rechts kloppen gemakkelijk nacht krant.
4100,89,5,2025-08-04,1.5,Manier niet jong nee schaap werelddeel.
4101,81,4,2024-11-04,8,Bed jas auto orde huren kopen.
4102,114,2,2025-05-21,4,Niets doen medicijn nat ademen wolf.
4103,9,4,2023-06-19,2,Dik aanbod presenteren oceaan ring wind.
4104,126,2,2025-12-17,6.5,Liniaal poort luisteren jij.
4105,143,2,2023-06-17,6,Afname morgen sport slot.
4106,6,3,2024-07-17,3,Zee gat team.
4107,14,6,2023-08-04,4.5,Liegen vogel tafel op zorg kiezen.
4108,123,4,2024-10-08,2.5,Instrument grootmoeder normaal kunnen.
4109,26,6,2024-03-28,8.5,Gezicht meer onderzoek.
4110,134,1,2025-10-30,6,Klasse morgen lachen kijken vijand.
4111,116,1,2024-10-14,2,Tamelijk vork binnen hem leiden.
4112,22,1,2023-09-06,1,Resultaat trouwen vechten falen help.
4113,139,5,2024-05-24,8,Model wakker rechtdoor.
4114,102,2,2023-10-03,7.5,Opleiding deel soep controle.
4115,12,1,2024-05-13,7.5,Vergelijken instrument huilen traan geluid makkelijk.
4116,146,2,2025-12-23,3,Meest geluk rook boord mijn offer.
4117,17,3,2023-03-29,3.5,Orde doen laatst.
4118,62,7,2024-09-05,2.5,Groot meer dienen verschrikkelijk dapper.
4119,62,7,2023-05-23,3.5,Daarom kip vannacht.
4120,22,4,2025-04-03,2.5,Hond redden zwaar hard zuid.
4121,75,4,2024-12-15,6.5,Zulke soep repareren open nul familie.
4122,2,6,2024-12-24,2,Kort luisteren naam medicijn hert boom.
4123,27,6,2026-01-20,3.5,Af tussen teken gerecht.
4124,26,6,2024-08-20,4,Tekenen bel anders bij.
4125,74,8,2025-03-01,8.5,Hier persoon pistool geboren.
4126,101,2,2026-03-09,2.5,Mevrouw zij groeien.
4127,76,7,2023-07-27,4.5,Zout ongeluk proberen hobby graf.
4128,149,4,2023-03-29,7,Dichtbij plaat schip kamer naar.
4129,132,1,2025-08-23,4,Dik huur lood hoop koud.
4130,110,7,2023-11-21,6.5,Doorzichtig gereedschap cirkel.
4131,88,3,2023-01-10,3,Baan kleur maken verspreiden.
4132,78,5,2025-12-03,1.5,Een bieden kennis.
4133,21,1,2023-05-21,8.5,Stelen veranderen borstelen munt plus tekenen.
4134,95,4,2023-08-03,6.5,Voet activiteit beslissen kost bank noemen.
4135,119,5,2024-11-16,6.5,Verrassen fout cadeau.
4136,11,4,2023-03-29,3,Oceaan teken meneer periode op kleren.
4137,40,8,2026-02-21,6,Lach hoogte manier peper.
4138,42,8,2024-03-14,1.5,Vak verstoppen grof helft afgelopen doen.
4139,40,2,2025-05-09,2.5,School delen niets vergeten.
4140,82,8,2024-06-23,7.5,Speciaal gemeen maal maaltijd.
4141,94,4,2023-08-26,6,Kat geboren bevatten vergelijking.
4142,13,7,2023-02-14,6.5,Waarom antwoord dichtbij.
4143,1,3,2025-10-11,4.5,Politie vallen warm toekomst papa.
4144,149,8,2023-12-21,6.5,Richting krijgen klimmen als.
4145,102,2,2024-07-06,8.5,Wens toekomst vis ons stoel.
4146,132,3,2024-04-30,8.5,Van uitvinden persoon.
4147,81,4,2025-10-02,1.5,Verliezen klasse rechtvaardig paar voor.
4148,35,2,2023-02-13,7.5,Kruis object terug hal zeven gaan.
4149,10,4,2025-02-24,8.5,Groep elk beslissen.
4150,148,8,2024-09-16,2,Breken vertellen verstand.
4151,128,6,2024-02-25,6.5,Hier wit iets.
4152,64,7,2025-11-14,2,Schreeuw gedragen hobby.
4153,131,1,2024-08-04,8.5,Liggen openlijk aanraken.
4154,3,1,2024-05-29,1,List mits laat ontvangen.
4155,150,7,2023-08-19,3,Tram uur vriend lopen.
4156,116,3,2023-02-17,2,Regen model natuurlijk beslissen.
4157,12,5,2024-12-15,3,Bot vader jongen vullen.
4158,71,2,2023-05-19,7,Hobby buurman tante lui.
4159,131,8,2023-03-13,7.5,Paar totaal los god gebeuren vertellen.
4160,84,2,2023-10-02,1.5,Glas pistool oorlog wassen natuur.
4161,82,2,2023-02-10,1.5,Papa gebruiken pas.
4162,82,6,2026-03-03,2,Koken ziek periode blazen.
4163,17,8,2024-05-06,8,Koud heet aap kloppen gebied leeftijd vader.
4164,42,5,2024-09-25,1,Geen berg product bed mes.
4165,139,3,2026-01-19,4,Geluk schaap avond altijd netjes.
4166,62,3,2025-03-09,3.5,Probleem hard titel doorzichtig geboorte.
4167,144,5,2023-12-30,3,Knippen haast bellen.
4168,4,5,2023-10-23,2.5,Halen naar maan heet oma.
4169,29,2,2024-03-14,2.5,Vangen oranje mogelijk munt machine vragen.
4170,11,4,2025-12-28,8,Kraam boven zorg wassen.
4171,29,7,2024-09-17,4.5,Tuin aanval betalen mengsel zaak.
4172,4,3,2024-03-16,1.5,Rapport hij vroeg overal.
4173,50,1,2026-01-23,4.5,Vandaag west liggen bos.
4174,10,6,2023-11-07,8,Liefde ontwikkelen taal.
4175,40,2,2024-04-29,4.5,Zuid groen alles.
4176,119,1,2026-03-15,3,Goed hamer winkel.
4177,139,6,2023-01-21,3.5,Huren orde liniaal gebruik geen.
4178,144,4,2023-03-03,1,Help onderzoek krant seconde ijs wijs.
4179,8,8,2023-10-07,3,Ons brandstof tennis altijd.
4180,26,4,2024-03-18,6.5,Spelen kans vrijheid vlieg.
4181,50,3,2023-03-12,7.5,Heuvel school opeens.
4182,111,1,2023-07-11,1,Klok koud ja soep.
4183,113,8,2025-11-09,4,Zak perfect publiek.
4184,8,5,2023-10-19,2,Geit zullen foto ons help.
4185,119,2,2024-10-09,8.5,School diep moeilijk snelheid dichtbij.
4186,19,8,2025-10-12,1,Tram vakantie veel verleden.
4187,91,4,2023-01-13,4.5,Vertellen ziek gemakkelijk plaats vier.
4188,68,5,2025-04-13,1,Oceaan rekenmachine gezicht bieden week.
4189,54,6,2024-08-23,8,Grappig enkele bus tas.
4190,4,3,2023-10-23,1.5,Koffer wiel leger kasteel olifant bord.
4191,82,2,2024-12-02,2,Veilig maaltijd buurman voedsel.
4192,82,5,2023-10-18,7,Knippen iedereen koken.
4193,53,7,2025-07-02,8.5,Offer eenheid vlieg straat koken kopen.
4194,122,6,2023-02-16,2,Niet overal afhangen wij reizen plein.
4195,38,8,2024-10-08,1,Kans aap vis paar geliefde.
4196,89,1,2025-04-17,1.5,Markeren verhaal boord.
4197,104,6,2023-10-02,3.5,Zonder koningin stom zeker kantoor buurvrouw.
4198,38,2,2023-08-18,4,Hotel plaats drinken.
4199,94,2,2023-08-06,6,Aardig rest thuis.
4200,118,5,2023-12-16,8.5,Restaurant storm bijzonder.
4201,140,7,2026-01-02,4.5,Langzaam laatst verliezen lunch oma.
4202,37,4,2025-11-18,7.5,Zetten stoffig plat bijten.
4203,3,5,2025-08-07,4,Verstoppen aanbod rijzen.
4204,8,4,2024-09-30,4.5,Mond rechtdoor eigen verspreiden rest kist.
4205,33,1,2025-06-16,8,Plant tante schaar voorbeeld slecht om.
4206,24,7,2025-10-01,3,Medicijn eis werelddeel bevatten gisteren.
4207,118,4,2024-09-07,1,Negen midden voor zo.
4208,57,6,2025-03-15,6,Genieten zout versturen wij ziek speciaal best.
4209,149,7,2024-04-16,3.5,Buurvrouw betalen zout.
4210,148,3,2024-07-07,4,Correct dag kuil straat natuurlijk zon.
4211,94,5,2023-08-29,2.5,Buiten klok presenteren plattegrond.
4212,3,3,2025-06-03,2,Verder dier laag tante.
4213,143,3,2023-05-16,2,Les gelijk moeilijk hoed plastic orde laag.
4214,1,4,2023-01-30,3.5,Lepel afgelopen gemakkelijk geboorte ook.
4215,6,1,2024-03-22,1,Smaak station redden.
4216,76,5,2026-01-28,6.5,Dag vrede delen volgende uitzoeken.
4217,33,1,2025-04-05,4,Vuur drogen voor geluid op.
4218,36,5,2023-01-07,6,Verleden ons verleden doorzichtig eend één.
4219,6,2,2023-09-01,4,Laat gevolg helder naam tafel gerecht.
4220,72,3,2025-02-26,6,Leeuw signaal noemen moeten vinger voetbal bewegen.
4221,133,1,2025-10-09,2.5,Gaan leeftijd als slapen.
4222,89,2,2025-03-06,1.5,Hoewel minuut binnenkort.
4223,79,7,2026-01-26,4.5,Hoek ja rok tevreden begrip.
4224,6,5,2024-05-16,1,Schreeuwen doos meerdere medicijn passeren.
4225,35,2,2024-03-24,2.5,Wat ook scheiden afhangen.
4226,28,2,2024-05-15,4,Wreed woud machine brug.
4227,79,6,2024-10-13,1.5,Volgende zes komen alleen.
4228,45,1,2025-10-23,2.5,Eeuw mogelijk beter.
4229,4,2,2024-01-23,7.5,Dromen hoeveelheid rechtvaardig.
4230,74,5,2025-01-13,2.5,Ons met teen soms ziekenhuis trui.
4231,130,6,2025-04-25,4,Pad kamer mes oom.
4232,85,5,2025-02-07,6.5,Beroep zeer vangen gevaarlijk lomp.
4233,43,1,2025-04-08,4.5,Bevatten meel foto.
4234,81,1,2023-07-15,1,Zeil lucht fris nee deksel.
4235,148,3,2023-10-13,7,Kok raken verzamelen bot doen.
4236,150,8,2023-10-10,7,Half vers examen angst afgelopen bang.
4237,1,3,2026-05-06,8.5,Zacht antwoorden wissen schrijven oom.
4238,101,2,2025-03-11,2,Plein zullen olie mond.
4239,40,8,2025-10-14,3.5,Zeer vergissen drie breken.
4240,56,7,2024-04-10,8.5,Ruimte naar erg drie licht snel.
4241,101,8,2024-09-30,2,Tamelijk halen jaar echt man.
