uur_id,project_id,medewerker_id,datum,uren,omschrijving
969,96,2,2025-04-10,8,Teen gezicht zeep machine zuid gelijk.
970,117,7,2024-09-10,6.5,Groep ruimte gras.
971,47,8,2024-05-03,6,Teken hard ontmoeten baan.
972,63,7,2025-02-25,1.5,Kant reeds thee vak.
973,72,3,2025-06-10,6.5,Ademen hen regen vergelijking vernietigen liegen.
974,34,8,2023-06-09,7.5,Lezen maat zelfde.
975,128,3,2024-10-28,6,Praten of krijgen oor bij vraag.
976,32,7,2024-09-22,4,Hobby benzine dun tas grijs vijf.
977,27,4,2024-11-01,4,Gebruik drogen vinden.
978,43,3,2023-10-12,6,Geel recht een.
979,113,8,2025-07-16,6.5,Verwachten oor bal snelheid belangrijk smal.
980,89,5,2024-02-05,2.5,Zilver afmaken verlaten verrassen.
981,26,1,2025-06-09,7.5,Snijden paard jagen bibliotheek liegen mond.
982,88,1,2025-11-11,4,Even ontdekken verdienen ruiken.
983,1,6,2025-01-26,6,Prinses vlees dapper.
984,9,4,2023-08-13,8.5,Park kans zilver vraag kip.
985,94,7,2025-06-03,7.5,Plaats doen basis wens.
986,64,3,2025-04-11,4.5,Alsjeblieft passeren vaarwel moment test mogelijk.
987,112,6,2025-08-30,2,Sluiten wijn klasse oost rechtvaardig derde.
988,37,3,2025-05-04,2.5,Zaak zand zuid.
989,42,8,2023-01-24,1,Model onze normaal ladder start vernietigen.
990,41,7,2025-06-13,2,Tussen partner reeds naam hoed einde.
991,53,8,2025-07-22,8.5,Hamer gemeen gemakkelijk te kant lot.
992,112,6,2025-11-09,4.5,Schip lijk zak.
993,2,8,2024-04-07,2.5,Kant jij moeder waarschijnlijk rapport.
994,120,6,2024-04-29,7.5,Gedrag titel gebruiken verandering zonnig week.
995,108,2,2023-03-10,1.5,Tennis krant opa daarom.
996,42,5,2026-04-03,4,Trouwen iets bruikbaar krijgen.
997,26,4,2025-08-10,6,Zomer ooit poort tekenen vrede vlieg.
998,92,1,2025-08-25,7,Doos ladder tas.
999,138,8,2024-12-04,6,Stil buurvrouw arm leiden schetsen zorgen.
1000,122,6,2025-11-15,4.5,Moorden negen knippen.
1001,11,5,2024-08-26,3,Jouw kost of slot bruin.
1002,139,3,2026-02-28,3,Orde piano zullen bed stempel.
1003,8,5,2026-03-19,1.5,Wolf vullen poes sterk leren.
1004,148,2,2025-09-19,1,Schudden start sorry opnemen vast mogen.
1005,84,5,2024-07-23,3,Vos ouder keuken.
1006,51,3,2024-06-10,1,Kleden leven mogelijk opleiding winkel.
1007,79,4,2025-07-03,3,Geel midden bedreven.
1008,100,2,2025-09-20,2,Vraag oor verlaten leeftijd honderd hoeveel.
1009,144,7,2023-10-25,6,Woud bal winnen voet.
1010,49,4,2025-02-23,2.5,Leger groen voeden hobby.
1011,15,5,2026-03-29,7.5,Grootmoeder bruiloft grappig leven vol.
1012,134,7,2023-08-26,1,Wijn gewoon park boven.
1013,71,7,2025-09-02,3.5,Rest dan extreem vergissen.
1014,43,7,2025-03-09,4.5,Ander vriend zee nobel.
1015,111,6,2023-01-25,3.5,Aarde verf alsjeblieft eten.
1016,28,6,2025-12-21,7,Leeftijd liggen buurvrouw lopen wanneer snel.
1017,98,5,2025-06-03,6.5,Liggen lenen gisteren.
1018,78,7,2024-06-30,8,Zulke stad brug.
1019,56,6,2025-08-02,8,Uitnodigen stoel gebeuren bewegen dik.
1020,3,2,2024-01-04,3,Grijs poes mooi terug slaapkamer.
1021,31,8,2023-01-25,4,Voorzien baan boos sinds naar.
1022,77,4,2024-12-20,2.5,Verjaardag reiken vliegtuig auto.
1023,16,4,2023-03-11,1,Aardig correct klaar wind ring glas deze.
1024,35,2,2026-05-12,7,Start grond elk vlees.
1025,33,3,2023-09-24,4,Vertellen storm aanval beroep offer familie.
1026,21,8,2024-06-02,3.5,Baan schaduw perfect politie.
1027,95,5,2024-07-20,8.5,Praten melk rechts dus.
1028,83,1,2023-11-28,8,Verhoging vlees restaurant meubel.
1029,17,5,2025-02-22,4.5,Kok kaart meer boete brief voedsel studie.
1030,19,8,2024-06-26,2.5,Laken liniaal genot langzaam.
1031,52,8,2024-02-15,6.5,Maand hoeveel broer schouder.
1032,65,2,2023-08-11,2.5,Telefoon meisje uitvinden.
1033,31,1,2025-06-23,7.5,Pad schaduw andere god fles vers.
1034,130,1,2023-05-30,1.5,Belangrijk teken gezond hoek koffie.
1035,11,7,2025-10-16,2,Laten gezicht begrijpen meneer fris.
1036,114,1,2024-06-29,2.5,Herinneren kruis ontvangen.
1037,140,7,2025-11-21,7.5,Niets terwijl breken zeven.
1038,68,1,2025-04-07,8,Hotel papa afval soort uitleggen blijven.
1039,36,6,2025-02-26,7.5,Waar taxi object recht na.
1040,117,1,2024-11-13,7.5,Niet zonder vergissen komen snelheid.
1041,22,8,2023-07-05,3.5,Uit vullen huilen fles.
1042,52,1,2024-08-16,7,Wijs avond al wijs.
1043,89,7,2025-02-25,7,Missen traan bang.
1044,142,2,2023-08-07,7.5,Helder gedrag tekenen genot.
1045,41,1,2025-06-15,7,Storm vallen klas kopen.
1046,143,7,2024-01-31,1,Verwijderen bezoek modern signaal.
1047,145,8,2023-05-10,8.5,Al stil nodig want boerderij.
1048,16,6,2023-02-03,1.5,Tram eiland papier hier honger mooi.
1049,64,8,2023-03-29,4,Helft luisteren boord.
1050,20,1,2026-01-03,2,Man half bodem zes om meisje.
1051,138,1,2023-10-17,4,Moeilijk kleur zulke sport wonder tamelijk.
1052,4,3,2024-05-12,7,Lood ook als.
1053,132,3,2023-04-13,3,Liniaal markt brandstof het.
1054,34,8,2026-04-25,1,Vader zilver boerderij.
1055,18,4,2026-05-03,8,Falen willen ouder bijzonder.
1056,96,2,2025-05-22,3.5,Piano manier sorry ongeluk geel.
1057,95,4,2026-03-25,6,Geur heuvel idee derde hond oneven.
1058,98,2,2023-04-04,6,Vinden goed feest onder mes.
1059,121,3,2023-09-05,3,Hij raken hond slecht moorden vertrekken.
1060,127,4,2025-01-27,6,Wassen laten bibliotheek.
1061,29,7,2026-04-06,1,Succes donker stop.
1062,22,1,2023-11-20,1.5,Elektrisch vijf broer vol.
1063,85,7,2023-01-15,2,Dragen uitnodigen mensen stop noot kop.
1064,62,3,2025-09-01,7,Bruikbaar zus soep voedsel.
1065,120,4,2024-07-08,6.5,Naast persoon kiezen raam.
1066,53,8,2023-12-24,6,Halen schaap uitleggen.
1067,102,7,2023-06-30,7.5,Naald gespannen maaltijd wie weg.
1068,56,2,2023-01-10,6,Door sneeuw manier.
1069,148,4,2025-12-21,1.5,Lach derde beroep zingen heuvel.
1070,83,1,2025-08-08,8,En bodem luisteren boek.
1071,139,8,2024-02-01,1,Maken dik jas olifant geboren plein.
1072,15,6,2023-12-28,2,Gras vast vijand opa.
1073,77,6,2024-08-06,2.5,Kennen taxi west oma.
1074,15,3,2025-07-17,1,Bibliotheek dichtbij staal groente.
1075,142,2,2023-11-20,8,Onderwerp buurvrouw naast probleem.
1076,96,7,2023-05-26,2.5,Houden teken oud groeien vaak.
1077,70,2,2024-02-12,7.5,Resultaat manier draad thuis zorgen bloed.
1078,72,7,2024-10-29,2,Deel door vlag honger vos beetje.
1079,20,8,2024-02-14,4,Vaak laten man helft tafel geluid.
1080,126,3,2026-04-13,4,Klas kloppen map heuvel naar.
1081,52,7,2024-03-18,6.5,Bieden papier film doos populair groeien.
1082,56,6,2025-02-03,2.5,Verhaal om meubel.
1083,37,1,2024-07-06,2.5,Schaap offer leren jaar.
1084,40,2,2026-03-10,1.5,Vierkant verstoppen tegen.
1085,50,6,2025-08-11,4.5,Spreken film olifant zwak wijn.
1086,50,4,2024-03-26,3,Kip werk zus einde kans.
1087,65,8,2023-06-27,4.5,Aardappel het boek kennis.
1088,124,4,2025-08-05,3,Mits ademen grappig publiek.
1089,67,3,2024-05-22,3.5,Koorts zus simpel gras beide ontvangen.
1090,13,1,2026-03-20,1.5,Verzameling weg zwak.
1091,123,7,2025-08-21,7,Los drinken storm publiek nooit bos keuken.
1092,131,8,2025-09-08,8,Vorm dienen stelen vijver compleet laken.
1093,119,4,2024-05-07,1,Behalve praten belofte.
1094,74,2,2023-09-29,3.5,Vertellen groeien verschrikkelijk.
1095,48,8,2023-02-02,4.5,Stem huis rijst vrede vraag draaien.
1096,132,8,2026-03-14,7,Soort kat afgelopen rennen lach restaurant.
1097,54,6,2023-10-11,8.5,Benzine ver missen.
1098,20,7,2025-08-08,7,Bijzonder liegen grens elk.
1099,88,7,2024-11-12,6,Kruis postzegel verkeerd wild heuvel om.
1100,22,6,2024-07-06,7,Iets ontsnappen schouder.
1101,15,2,2023-04-23,6.5,Wens blazen want duwen blad hoek.
1102,12,6,2025-02-23,3.5,Zelfde taxi toen fout kip bijten speciaal.
1103,62,3,2025-01-20,2,Herfst rubber willen vet.
1104,140,4,2024-11-16,2,Het kleden haar.
1105,81,7,2024-04-06,3.5,Dak hoe geboorte eenzaam.
1106,109,6,2024-07-21,1,Druk hand schreeuw glad.
1107,138,5,2025-07-15,4,Jullie kap tekenen nacht verdienen schaduw.
1108,18,4,2025-07-14,6.5,Avond vergelijken kloppen nieuw.
1109,114,3,2025-07-26,1,Zulke lengte provincie ruimte.
1110,49,5,2024-08-13,1,Falen schrijven model verdienen.
1111,145,3,2023-08-18,7,Blijven telefoon gewicht machine.
1112,88,7,2024-02-23,6,Wassen muziek politie.
1113,101,7,2026-01-13,2.5,Dag open kijken klas opleiding appel.
1114,87,4,2025-06-28,7,Plus vijf aardig.
1115,98,7,2023-05-09,1,Markeren huur vriend eenheid kaas.
1116,142,8,2026-03-31,3.5,Maat eend algemeen vader.
1117,91,3,2025-07-26,3,Ouder school staal manier gemakkelijk.
1118,109,5,2024-06-16,2.5,Paard meest kort bad welke.
1119,85,8,2023-04-07,2.5,Tand vreemd moeilijk lamp.
1120,86,3,2023-12-07,6,Woud kopen andere mooi.
1121,48,4,2023-12-26,8,Volgende zelfde willen elk.
1122,37,8,2023-08-28,1.5,Straffen cirkel hun zee ziekenhuis hert.
1123,62,1,2024-06-17,3,Uit luisteren doorzichtig.
1124,109,8,2024-10-11,3,Redden enkele drijven.
1125,36,1,2026-01-10,2.5,Bijna geld eten blijven.
1126,133,6,2025-04-08,4,Diep oefening tellen aap.
1127,88,8,2023-11-16,1.5,Ik mama schaar schreeuwen.
1128,128,6,2024-08-16,8,Resultaat verenigen slaapkamer tand boerderij chocolade.
1129,12,3,2023-08-19,7.5,Kop hoop groot.
1130,8,7,2026-02-02,1.5,Overeenkomen neus instrument richting ziekenhuis.
1131,27,6,2024-03-27,4.5,Gat pas te.
1132,67,5,2023-04-23,6,Kantoor missen aanbod paar koorts.
1133,130,2,2024-02-05,1,Product daarom eenheid.
1134,143,6,2025-11-14,4,Helder bloem klok dun.
1135,106,7,2026-05-20,6,Grootmoeder klopt vechten.
1136,108,7,2023-10-30,7.5,Gezond zaak dun.
1137,101,6,2025-02-02,1.5,Ruimte vergelijken maand bijvoorbeeld schaar.
1138,65,8,2024-09-22,4,Rechtdoor koud uur.
1139,86,3,2025-05-01,8.5,Hoeveelheid onze klimmen los.
1140,41,2,2025-05-18,7.5,Rapport rijk lang begrijpen langzaam stil.
1141,139,6,2023-10-22,2.5,Pan uitleggen list.
1142,26,1,2023-05-16,6.5,Tevreden sluiten verlaten ziel brengen.
1143,121,3,2025-04-18,7.5,Zoals nemen klimmen rok.
1144,60,3,2026-02-12,4,Aarde wit slapen.
1145,12,5,2025-02-20,3.5,Elektrisch vallen sport los.
1146,134,4,2026-04-13,3.5,Maand baby vies.
1147,46,5,2023-02-24,8,Kennen voorbeeld schaar geur idee.
1148,36,5,2024-09-06,7.5,Taxi alles god hamer.
1149,75,1,2025-05-04,2.5,Afname hoofd postzegel overal kaart.
1150,144,2,2023-09-02,8.5,Nemen koning dromen.
1151,141,7,2026-05-11,7.5,Boek spelen poort leiden gras ziel.
1152,35,6,2024-06-12,7.5,Gemeen ver vergelijken stap nacht luisteren.
1153,79,3,2025-11-15,7,Hoogte baan passeren.
1154,94,8,2026-04-06,1,Kleren zoals bieden.
1155,15,5,2023-10-05,3,Lang alleen wolk geven.
1156,14,5,2025-01-09,4.5,Vergeten lengte brug.
1157,150,4,2024-08-20,6,Ontdekken zullen persoon nobel.
1158,49,6,2024-01-11,8,School bedreven ontwikkelen fles.
1159,82,6,2024-10-09,8.5,Gras scheiden één missen bed.
1160,42,1,2023-07-16,6.5,Vrouw rots grap krant afspraak.
1161,109,8,2023-10-08,6.5,Rechtvaardig gras maaltijd totaal positie.
1162,31,4,2025-04-23,3,Gat afspraak hoofd.
1163,55,2,2023-11-13,6,Peper spreken passeren.
1164,34,3,2025-05-04,4,Openlijk positie horen koers welkom.
1165,92,6,2023-02-05,4.5,Ijs hoeveelheid veel.
1166,100,3,2023-10-12,8.5,Maal stil feit.
1167,67,3,2024-09-15,1,Rijzen gevangenis antwoorden verschrikkelijk.
1168,91,3,2023-10-19,7,Politie oma in.
1169,123,2,2024-03-05,2,Stop negen hem straat.
1170,125,1,2023-06-09,1.5,Rok anders plant doos jij.
1171,150,1,2024-02-07,1,Laatst tante straffen groot stoel.
1172,13,2,2025-08-18,1.5,Kist nieuw klasse wit.
1173,28,2,2024-09-09,7,Boete fris zuid.
1174,54,6,2026-05-17,2,Hal vet taxi zon zitten nul.
1175,84,6,2023-03-01,1,Straffen ladder paar hoeveelheid kap.
1176,148,2,2024-12-22,2,Rennen schaar populair.
1177,65,4,2023-07-22,8,Mits net geboorte kosten succes.
1178,29,4,2024-07-31,2,Veranderen lip water druk.
1179,107,3,2025-10-29,8.5,Aanval verdienen tamelijk rechts.
1180,53,6,2025-06-19,7,Klimmen rapport zijn.
1181,150,4,2025-02-16,4,Eenzaam anders gebied passeren model.
1182,36,8,2025-04-14,1.5,Paar stap winnen.
1183,144,6,2023-08-14,6,Passeren doos plastic sap wonder.
1184,24,6,2024-08-13,6,Stil voetbal recht.
1185,85,8,2025-10-08,1.5,Mond eigen waarom lui sorry geloof.
1186,128,4,2026-05-14,7.5,Wiel wassen honderd hallo vorm falen.
1187,124,4,2026-02-08,4.5,Lunch samen liegen geluk droog.
1188,108,3,2023-05-23,8.5,Mis brengen papa huilen warm.
1189,31,7,2023-01-27,7.5,Gemeen soort beslissen stop.
1190,35,3,2025-06-16,6,Vies zus verzamelen best lachen.
1191,50,2,2025-03-19,4,Voetbal nieuw sneeuw park.
1192,60,7,2025-01-14,2.5,Smal leven verandering bel vakantie verder.
1193,145,5,2023-09-09,2.5,Kap snel mond.
1194,117,6,2026-04-06,6.5,Leerling bus de gif ver.
1195,142,5,2025-09-01,7.5,Soms kat rechts.
1196,32,2,2023-10-29,8.5,Waar trouwen feit.
1197,71,3,2024-05-28,4.5,Houden schip luisteren.
1198,19,8,2023-03-02,1,Structuur succes ijs scherp houden list.
1199,96,3,2023-02-24,2.5,Ontsnappen over tak deksel.
1200,21,8,2024-09-12,6,Alsjeblieft voedsel onderwerp smaak.
1201,145,8,2025-08-12,2.5,Winkel dit populair markeren.
1202,5,1,2025-10-30,3.5,Ring diep uitzoeken chocolade partner.
1203,131,6,2025-05-31,1.5,Gevolg gebruik vers op deksel.
1204,11,1,2025-02-09,4.5,Gewoon soms stof.
1205,49,8,2023-12-29,6.5,Kraam pistool dragen ik dier verschrikkelijk.
1206,113,8,2025-06-01,2.5,Nacht klas weer punt vijver.
1207,138,8,2023-08-13,6.5,Dromen vraag afgelopen winter ijs hert.
1208,148,1,2026-02-25,8,Derde pas spreken bruin.
1209,110,6,2025-03-12,3.5,Kaars lunch waar vrijheid.
1210,9,1,2024-08-05,3,Vragen steun kap antwoorden plat woord.
1211,102,1,2023-09-20,8.5,Beroep oceaan neus steun vinger ziekenhuis.
1212,124,6,2024-11-29,4,Lijken naast gemeen.
1213,16,4,2025-01-01,4.5,Scherp raam genieten scherp.
1214,24,2,2024-05-22,2.5,Druk zo glas groeien stilte.
1215,50,1,2024-09-16,1.5,Vrijheid computer helft.
1216,133,7,2026-01-07,3,Gebruik opeens oorzaak maand.
1217,81,1,2026-03-09,6.5,Voelen beest totaal bevatten medicijn licht.
1218,94,7,2025-08-19,6,Elektrisch noemen fit mensen ontbijt oorzaak.
1219,29,8,2026-03-14,4.5,Soep liefde privé.
1220,99,8,2023-07-24,7,Uitzoeken periode lucht aan studie pad.
1221,49,5,2025-10-26,8.5,Politie horen meisje groot product glad.
1222,145,2,2025-01-14,4,Gereedschap grens oma herinneren lichaam zinken.
1223,80,1,2026-01-02,2.5,Mensen hoeveelheid zijn mama.
1224,68,2,2024-08-31,6.5,Dubbel tafel rijzen boek.
1225,82,2,2026-03-30,1.5,Ijs schaar veel eigen brandstof.
1226,124,4,2026-03-06,8.5,Film missen hoewel nek.
1227,90,5,2024-12-12,8,Sap weg feit.
1228,60,7,2025-06-05,7.5,Honger effect koning.
1229,53,1,2025-04-03,3.5,Verschrikkelijk pen ding zacht.
1230,145,4,2025-11-23,8,Rapport toen terwijl goedkoop werelddeel man.
1231,17,4,2025-08-15,3.5,Keus hen spelen verdienen.
1232,74,3,2025-01-16,4,Lip laten koken lachen tamelijk.
1233,120,6,2024-09-06,8.5,Begrip krijgen product dag lucht.
1234,120,5,2023-05-12,7,Afval simpel familie snel.
1235,78,4,2024-08-10,7,Verf alles leeg kleur.
1236,45,4,2025-04-11,2,Olifant en fit mits versturen boven.
1237,134,8,2023-02-26,2.5,Doen soort wild oud.
1238,11,4,2026-02-20,4.5,Tevreden koffer zee.
1239,9,5,2023-11-23,3,Gereedschap zonnig open bel behalve ijs.
1240,12,8,2024-07-22,7,Keuken water brengen controle storm hoofd.
1241,93,5,2023-02-10,1,Veilig vis opnemen onze oma.
1242,27,7,2023-05-11,4.5,Genieten ontvangen tamelijk gezicht nemen.
1243,146,2,2023-10-15,2,Scherp dak teen vijver.
1244,145,2,2025-12-04,7.5,Zak kant tekenen stom fit.
1245,93,6,2024-05-02,6,Maken maag hun rook simpel.
1246,72,7,2026-04-11,7.5,Pan werelddeel dak privé.
1247,51,4,2024-03-22,2,Koning mengsel bedreven neer waar.
1248,78,1,2024-07-16,4.5,Kind oneven zus zee vis hoop.
1249,33,6,2025-10-01,6.5,Middel onze positie station oneven zijn.
1250,76,5,2026-01-22,4.5,Nemen tussen verliezen.
1251,108,5,2023-10-24,3.5,Ontwikkelen maken raam.
1252,15,4,2023-02-13,7,Straffen te leger grijs.
1253,92,6,2024-06-02,6.5,Voorbeeld zullen dichtbij houden duur.
1254,128,7,2023-09-07,6,Iedereen nee schijnen vast lenen algemeen.
1255,90,2,2023-01-17,4.5,Hamer plank koers acht honderd derde.
1256,48,8,2024-04-27,3,Opa te net rapport.
1257,10,5,2024-10-11,8.5,Teen onze jouw voedsel.
1258,138,7,2023-06-14,8.5,Dichtbij tekenen extreem duur altijd pad.
1259,29,3,2024-11-12,7.5,Terwijl noch wreed.
1260,103,7,2024-06-18,6,Vijver welke redden enthousiast dood.
1261,132,1,2026-05-18,7.5,Geel wapen tekenen ander.
1262,128,3,2023-04-17,7,Buren wit alsjeblieft vies verstand.
1263,91,6,2023-01-07,4,Klein lijken kop examen.
1264,47,4,2026-03-25,1,Oranje bus ziek moeilijk oom.
1265,120,6,2025-11-23,7,Buiten succes bui met papa storm.
1266,79,3,2025-07-13,4,Laatst feit blijven moeilijk me.
1267,85,4,2026-04-29,8.5,Brengen lucht aardig uitnodigen kopen vertellen.
1268,53,7,2023-06-22,4.5,Kans hert berg winnen raken.
1269,6,1,2025-02-11,8,Zwemmen binnen proberen koers.
1270,26,8,2026-02-17,7,Afhangen zeker springen vraag bed vernietigen.
1271,14,7,2024-02-11,3,Onderzoek cadeau dier schoon.
1272,45,2,2025-05-28,6.5,Bellen uitleggen vierkant.
1273,4,7,2025-01-23,2,Kiezen laat ding drijven.
1274,35,4,2025-07-18,8.5,Zelfde steun vak duur voeden breed.
1275,86,8,2024-02-21,2.5,Anders even kosten kind.
1276,62,4,2025-02-21,2.5,Plaats andere alsjeblieft andere.
1277,122,3,2024-08-02,7,Arm vinger waarom bedekken klas overvallen.
1278,9,5,2025-04-16,8,Draaien boos jaar gebeuren laken beroemd.
1279,76,6,2024-06-20,2.5,Maand laatst vragen lichaam versturen vader.
1280,24,1,2026-04-08,7.5,Heuvel makkelijk vriend.
1281,116,4,2025-08-18,2.5,Honderd nobel zacht.
1282,78,2,2025-02-24,7.5,Me stop verschil.
1283,15,6,2023-07-15,6,Buurman moorden uitzoeken dansen.
1284,13,1,2024-04-25,4.5,Stilte snelheid grond.
1285,90,7,2024-06-03,6.5,Bouwen geboren een reeds horen zij.
1286,52,5,2025-01-29,2,Naald ook voetbal taart compleet lang.
1287,99,8,2023-12-14,6.5,Oor west arm.
1288,125,3,2023-09-28,1.5,Politie trekken zo afgelopen positie.
1289,13,3,2024-06-17,1.5,Dom honderd ontvangen meisje.
1290,106,7,2025-10-19,8.5,Eenheid vijf ziekenhuis kraam zuid.
1291,93,7,2024-08-02,3.5,Plaats nooit bruikbaar groente team.
1292,45,8,2023-12-04,3.5,Idee voorzien gevangenis uur mensen.
1293,15,4,2023-04-19,2,Lucht boete versturen tand gif tevreden.
1294,79,3,2024-01-11,1.5,Privé zeker buurvrouw gebruik lui.
1295,144,1,2025-08-14,4,Bui sluiten buurvrouw.
1296,133,8,2025-06-23,3.5,Herfst les zon bijvoorbeeld vierkant.
1297,36,6,2023-08-19,8,Duwen vast vol moment dan rubber.
1298,53,3,2023-07-11,2.5,Elk stoel natuur.
1299,64,1,2025-11-07,8.5,Onder nek bedekken.
1300,121,2,2025-12-13,8,Kantoor gedrag wissen nek kip boos.
1301,28,6,2024-05-19,8.5,Positie vertrekken geboren wens.
1302,114,6,2023-02-23,3,Noch zaak langzaam.
1303,46,1,2026-04-24,1.5,Groen zee wit hart.
1304,132,5,2023-06-16,4.5,Zien vork maken correct wij aan.
1305,97,1,2026-05-01,7,Slecht resultaat familie start.
1306,64,1,2025-07-16,3,Zee bel kuil dapper veel tante.
1307,20,7,2024-08-02,3,Koffie dochter laken orde.
1308,52,4,2023-07-09,4.5,Vergelijken best zeil grijs.
1309,63,3,2025-03-27,1,Buren ster winkel deze liegen.
1310,85,3,2025-03-06,8.5,Tafel actief bruikbaar heuvel.
1311,125,5,2023-09-04,3.5,Teken overvallen geel.
1312,28,6,2026-05-20,2.5,Hebben bus stil los best.
1313,130,7,2025-11-15,2.5,Vlees wolf bad vergeven gevangenis.
1314,27,7,2025-09-02,3.5,Maat opa vlieg schieten trekken taal gebied.
1315,126,7,2025-01-24,6,Blazen stad zee.
1316,134,4,2023-07-10,1.5,Geluk verrassen mij seconde lenen.
1317,87,8,2023-11-14,4,Presenteren vier groep.
1318,89,3,2025-06-14,1.5,Vriezen prins horen rest.
1319,76,7,2023-09-19,7.5,Zomer bijzonder bord uitzoeken.
1320,21,1,2024-08-28,6,Opeens gat lengte glas.
1321,120,2,2025-11-17,1.5,Om vergeven kist na week kleur.
1322,103,5,2025-08-09,7.5,Branden vergissen privé boon boek zes.
1323,34,8,2026-04-14,1,Kans rijzen vriendelijk land.
1324,114,1,2024-01-03,8,Snijden baby publiek lichaam maag.
1325,93,8,2023-06-20,4.5,Avondeten koorts uitzoeken stoel leiden vroeger.
1326,100,3,2025-07-10,6.5,Ongeluk als winnen boon.
1327,79,2,2024-03-08,2,Uit springen verrassen gevaar vannacht.
1328,2,7,2025-06-07,6,Jong zelfde grijs thuis hoofd.
1329,140,8,2023-08-27,1,Team doen olie verzameling.
1330,90,6,2025-04-09,8.5,Sterk student test drijven minuut.
1331,26,3,2025-03-19,8.5,Hun piano ster.
1332,33,1,2023-10-04,1,Hoed hemel waarschijnlijk blijven.
1333,63,8,2024-01-21,8,Hier min eend kleur glad.
1334,126,4,2023-10-25,7,Jas uitzoeken vos studie zee honderd.
1335,43,8,2023-06-26,3.5,Eerste het moeilijk.
1336,49,3,2025-05-14,1,Hart olifant druk pistool bewolkt bodem.
1337,6,8,2025-06-30,4.5,Waarschijnlijk rekenmachine verschrikkelijk de iemand jongen.
1338,88,7,2026-04-13,2,Wassen bos zacht.
1339,31,7,2023-04-15,3,Perfect ziekenhuis honger gebied.
1340,87,1,2025-05-01,8.5,Genieten dier zuid.
1341,150,8,2025-09-25,4.5,Mij vergelijkbaar zomer.
1342,5,7,2024-04-19,7,Vlees lichaam vakantie de.
1343,81,7,2026-03-26,3,Gemakkelijk al per vergeven.
1344,101,8,2025-08-27,1.5,Of zwembad ei eend na.
1345,86,4,2025-06-12,1,Plattegrond voor zo stoffig slaapkamer.
1346,71,4,2025-08-19,3.5,Uitnodigen gisteren keus vreemd wie.
1347,136,3,2026-04-18,7.5,Noch bibliotheek schip hond verandering.
1348,121,6,2024-08-23,7.5,Trouwen oom boete wanneer.
1349,63,5,2025-08-25,8,Slecht niet bot veranderen gebruik jaar.
1350,38,3,2023-06-26,7.5,Vechten gebeurtenis goedkoop vergeten maag leuk.
1351,29,7,2024-02-13,2.5,Les woud drie olifant olie beide.
1352,63,1,2025-10-08,3,Markt slaapkamer beneden jouw wreed.
1353,104,3,2023-02-07,3.5,Ontbijt wissen sport smaak.
1354,18,6,2023-12-24,8,Leger tante conditie koning reiken hert.
1355,35,4,2025-05-31,1,Houden ontbijt vlees winter.
1356,103,1,2025-09-23,3.5,Taxi zoals open.
1357,150,2,2026-02-14,3,Ziekenhuis beetje studie.
1358,33,2,2023-04-14,4.5,Bruin zinken perfect negen staal stap.
1359,148,2,2023-07-28,8,Zo telefoon zorgen vergelijking.
1360,62,6,2023-12-09,7,Raak mij bruin.
1361,128,8,2023-11-18,7.5,Boek kosten schudden.
1362,98,3,2023-07-23,2.5,Uitvinden kleren map vernietigen duwen.
1363,127,7,2023-09-09,8,Jullie slapen voeden minuut.
1364,100,5,2023-01-14,2.5,Gezicht enkele jij publiek.
1365,81,6,2025-10-31,2,Iedereen straffen nacht.
1366,45,7,2025-04-29,3,Voeden belangrijk offer.
1367,120,7,2024-04-12,2.5,Boerderij aanbod zonder ademen hoogte.
1368,9,8,2025-07-28,8.5,Ander vrij onderwerp vertrouwen.
1369,19,2,2023-10-26,8,Eenzaam plaatje duur fris.
1370,49,7,2024-11-23,3.5,Boete samen diep kip droog.
1371,45,1,2023-05-06,4,Slaapkamer voeden druk deksel vannacht.
1372,117,5,2025-11-30,3.5,Plafond wetenschap voor.
1373,84,3,2024-10-04,3,Vaak heuvel half.
1374,128,6,2025-04-07,4,Samen oranje dorp boord eigen.
1375,90,2,2025-04-08,8,Zwak wapen wiel.
1376,113,3,2023-03-17,6.5,Verenigen tien winkel resultaat berg genoeg.
1377,64,2,2025-12-01,6.5,Geloof vanmorgen eenzaam.
1378,100,3,2025-11-13,6.5,Bal beker zoet meer verkopen.
1379,74,5,2023-02-17,1.5,Boon naald rekenmachine hoewel nee oog.
1380,17,6,2025-05-15,6,Naar succes proberen grond cool tand.
1381,36,1,2024-06-15,7.5,Winkel leeftijd leren bijvoorbeeld.
1382,2,8,2023-09-13,4.5,Mevrouw hond melk.
1383,102,5,2024-11-25,2,Hemel zuid tegen tegen schreeuwen.
1384,110,4,2024-08-05,7,Verenigen eenzaam blij voorzien stom ontmoeten.
1385,106,8,2023-08-04,3,Prins ster neus bedreiging.
1386,120,2,2023-07-20,2.5,Klok jij nieuw veer.
1387,38,8,2023-07-08,1.5,Stempel nacht dubbel keus schrijven.
1388,108,7,2024-03-15,4,Boon wolf voorzien sluiten.
1389,80,8,2026-04-19,6.5,Smal mijn ontmoeten.
1390,121,3,2025-05-17,4.5,Afhangen wat extreem scherp we aap.
1391,142,8,2023-10-23,6,Reeds wachten houden druk.
1392,64,8,2023-09-22,7,Veranderen kiezen vergeven basis dan.
1393,108,2,2025-08-27,1,Plaats gewicht wat rubber.
1394,33,2,2026-05-17,8.5,Hert wijs rapport waarom kruis actief veer.
1395,12,3,2025-01-26,6.5,Groen vreemde vangen mes paard.
1396,109,5,2023-08-30,3.5,Schijnen bal te chocolade scherp best broek.
1397,42,3,2024-08-25,4,Vriend mes echt hoop.
1398,91,5,2026-04-22,4,Zaak sneeuw schoon grootmoeder.
1399,1,2,2024-03-17,2.5,Grootmoeder ontdekken brandstof bruin.
1400,13,7,2026-01-26,3,Wolk ochtend min cadeau.
1401,131,6,2025-09-12,6.5,Maken breed gebruikelijk.
1402,41,8,2025-02-11,4,Een tamelijk uur geluk persoon.
1403,45,6,2025-07-10,7.5,Stempel liefde teen reizen model.
1404,113,4,2023-07-02,8.5,Team speciaal bank afgelopen.
1405,128,5,2025-03-20,3,Iets wolk wassen.
1406,8,5,2023-07-01,8,Maaltijd vreemde behalve klein winter.
1407,24,4,2026-02-23,7,Beneden echt eiland redden leven vinden.
1408,55,8,2026-01-14,6,Verkopen pad haar.
1409,53,1,2025-10-26,1,Dapper zeker behalve sap.
1410,75,8,2024-07-17,8,Na afname sok speciaal hond.
1411,117,1,2023-06-23,8.5,Dapper bos geen.
1412,100,7,2025-10-03,8,Aanval beker knie ongeluk vertellen.
1413,94,7,2024-01-05,4,Auto nooit afval veer markt ontmoeten klopt.
1414,29,3,2024-06-10,1,Klopt vullen geliefde meubel geschikt zoals.
1415,78,2,2024-08-07,2,Meel vragen los voeden gebeurtenis.
1416,50,1,2023-11-12,3.5,Praten drogen zetten zwemmen.
1417,16,5,2024-10-28,2,Kennis al uitzoeken dapper.
1418,42,7,2025-03-09,1.5,Kuil voeden verschil zoon buurman.
1419,35,1,2024-10-25,3.5,Jong wild land lachen start liegen knippen.
1420,144,7,2024-02-19,2,Idee repareren conditie negen genoeg.
1421,94,8,2023-08-24,3,Ontsnappen wit springen tien.
1422,141,1,2026-02-06,4,Vreemd normaal tand krijgen probleem.
1423,5,5,2025-04-14,7,Kok mama noemen lood.
1424,76,3,2026-02-08,6,Kunst en idee voorbeeld reeds wiel.
1425,130,2,2024-09-15,6.5,Dus liefde schip kloppen rest.
1426,109,3,2025-10-21,2,Zomer rubber teen prinses.
1427,131,1,2024-05-17,6.5,Tevreden elektrisch kunnen maken vijand comfortabel.
1428,87,3,2023-01-03,8.5,Hoed werk per steen vlees rood.
1429,82,5,2023-01-02,1.5,Binnenkort acht verzamelen.
1430,149,5,2025-02-17,3,Huilen blij wereld.
1431,89,2,2023-04-04,2,Eten derde film verhoging kantoor.
1432,41,5,2025-03-20,7,Op verder markeren signaal hal.
1433,100,5,2025-06-03,2.5,Uitleggen dochter voedsel.
1434,95,6,2025-07-16,3,Laatst net pistool dit.
1435,5,3,2024-03-07,4.5,Plein schrijven grof vernietigen gereedschap broer.
1436,2,1,2023-01-05,6.5,Vrouw boom baby.
1437,114,2,2023-12-22,4.5,Mand markt te open zoon.
1438,128,2,2023-06-08,6,Wens opa duur vork ziekenhuis.
