uur_id,project_id,medewerker_id,datum,uren,omschrijving
1,88,5,2024-04-30,4.5,Eiland vergelijkbaar wat meel.
2,83,1,2023-02-14,8.5,Tuin product meerdere plattegrond voorzien niets.
3,145,5,2026-03-05,8,Maaltijd van weg behalve naar.
4,67,4,2024-04-16,6.5,Speciaal hoe niet familie schaap tweede.
5,28,1,2024-05-28,7,Beroemd delen verhoging iedereen kist.
6,10,6,2024-09-24,8.5,Verkeerd ontdekken koers overal vet straffen.
7,96,7,2023-09-27,1.5,Sleutel graf blad vliegtuig kiezen.
8,107,5,2023-12-26,2,Foto helft brief tien.
9,88,6,2023-12-03,3.5,Waarom liegen als meest.
10,42,4,2023-08-24,4,Diep iemand meisje vis het hoop.
11,27,7,2025-03-24,8.5,Veel wij rood.
12,132,6,2023-01-29,3,Examen avond knie.
13,109,2,2024-06-20,6.5,Brood het basis veroveren vinden hun.
14,96,4,2024-04-23,4,Bos taxi stof.
15,90,7,2023-05-10,7.5,Ook hier voorzien.
16,11,5,2023-08-27,2,Enkele haan net tekenen rijst.
17,72,3,2025-10-05,1,Delen grappig afhangen plafond.
18,122,3,2025-03-06,4.5,Borstelen noemen nu graf wind uitvinden.
19,143,7,2025-04-29,7,Gemeen betalen perfect ieder liegen comfortabel.
20,65,8,2024-07-26,1.5,Vriendelijk beer klimmen blad koffie simpel.
21,29,6,2025-06-29,2.5,Plus schetsen lijk jullie huis elk.
22,17,7,2026-01-20,7.5,Bieden wat tante ons bloem uitleggen.
23,132,2,2024-07-19,2,Boom het probleem taxi mama.
24,14,6,2024-03-10,7,Dapper vos gewicht kap.
25,19,4,2024-05-13,2,Schrijven repareren toen voet.
26,97,3,2026-04-15,2,Mensen berg brief medicijn verleden.
27,43,3,2026-05-05,1.5,Te papa cadeau borstelen.
28,33,1,2026-01-11,3,Hoog raak tram.
29,72,6,2023-09-27,1.5,Maag oranje gelijk gemakkelijk dochter meest.
30,15,3,2023-02-02,2.5,Iemand vals oranje.
31,18,8,2025-05-12,6,Ons ijs school drinken richting.
32,150,2,2025-07-07,8.5,Vergeten broek overeenkomen hoog boom lijk.
33,13,5,2025-07-14,6,Zaak beslissen brandstof van.
34,17,8,2025-07-27,7,Hoop probleem bellen fout daarom.
35,143,8,2025-04-02,4,Vriendelijk potlood aan deel delen nemen.
36,43,2,2023-05-31,1.5,Persoon liniaal examen vliegtuig heel.
37,111,5,2023-09-16,3.5,Want wie snelheid wachten.
38,29,2,2025-07-18,6.5,Oost peper moment.
39,125,8,2026-02-03,7,Verschrikkelijk belofte vreemde.
40,132,7,2024-04-12,4.5,Aan om zitten.
41,93,7,2025-05-01,7,Verwijderen vier geit.
42,109,3,2024-10-02,7.5,Kom hoeveel kleur kleren nooit reizen.
43,24,2,2025-08-29,1,Dag oefening verkopen kans lachen haast.
44,38,1,2025-06-03,1.5,Controle betalen afhangen.
45,36,7,2026-04-16,6.5,Rechtvaardig zijn cool daar uitzoeken verwachten.
46,15,5,2024-12-25,8.5,Wens plank los langzaam vast klok.
47,31,4,2026-05-14,3.5,Één papa ook verliezen.
48,68,2,2023-11-13,7.5,Sluiten goedkoop weer ooit.
49,34,5,2024-12-18,8.5,Zitten ontsnappen simpel.
50,8,5,2026-03-21,2.5,Oorlog zeer bijna.
51,92,6,2023-03-01,2.5,Zomer zomer terugkomst maand bieden voorbeeld.
52,42,7,2024-12-19,1,Genieten poes rekenmachine.
53,27,4,2023-05-23,2,Sap nobel oor.
54,100,3,2025-02-09,4.5,Beetje ijzer terugkomst maken mooi makkelijk.
55,24,1,2025-01-27,3.5,Land zeep tussen hal auto.
56,22,5,2023-11-15,2,Storm spelen onderwerp bellen manier draaien.
57,142,8,2025-06-26,7.5,Rechts half stem.
58,150,2,2025-04-28,3,Haan bijvoorbeeld moeder.
59,85,8,2024-12-07,4,Geur persoon grens geven.
60,13,4,2025-12-15,7.5,Pan vullen stempel.
61,2,4,2025-03-20,6,Keuken dromen thee geld dus.
62,78,5,2024-09-09,2,Verzamelen ijs binnen de werk diep.
63,145,7,2024-11-02,1,Structuur kunst klimmen regen spel dorp.
64,70,6,2023-12-26,2.5,Station in privé stuk brood dorp.
65,126,1,2023-05-28,4,Markt markt wit wat geen.
66,124,7,2025-07-30,1.5,Map de vijver activiteit weg.
67,118,1,2025-05-05,3,Kleur hoe nek zaak boom.
68,106,2,2024-10-27,2.5,Praten zacht leiden want vertrekken huren.
69,75,7,2025-06-13,8,Uitleggen gevangenis opa maal.
70,116,5,2026-04-21,4,Station opleiding eiland idee.
71,50,2,2024-11-26,2.5,Hij actief acht beroep.
72,149,4,2025-11-11,7,Boom bos lijk fruit groot.
73,72,2,2024-12-16,3,Arm plaat behalve over.
74,51,3,2023-10-27,3,Wolk presenteren slecht bruin.
75,134,8,2023-06-04,2.5,Cirkel rechts vrede ongeluk zetten vouwen.
76,93,3,2026-03-02,7.5,Gevaar maat wie presenteren.
77,128,5,2025-06-19,1.5,Teen schijnen restaurant tegen.
78,103,2,2024-07-16,6,Dom bevatten terug kleur.
79,11,1,2024-09-27,4.5,Zus gewicht vallen druk beslissen.
80,21,2,2025-01-25,8.5,Pen dubbel middel dapper.
81,134,1,2026-05-01,6.5,Fris proberen waar sneeuw bos.
82,95,8,2025-07-10,8,Best sport terug.
83,131,2,2025-10-23,2,Vouwen deksel prins.
84,148,3,2024-12-04,7,Rennen glimlach schudden.
85,127,3,2023-03-22,2.5,Onze morgen wijn meubel les.
86,113,7,2025-01-15,3.5,Noch aanval wreed.
87,98,2,2024-11-23,7,Buiten niet zout hun helft begrip.
88,85,5,2024-11-06,1.5,Kasteel verspreiden iemand.
89,98,2,2026-05-19,8,Tafel hal eten ochtend zetten.
90,102,5,2026-04-08,7,Hebben koffer boven scheiden.
91,92,7,2025-03-13,2,Binnen poort steen dag eigen soep.
92,27,7,2024-11-03,8,Gelijk knippen tram proberen minuut zeker.
93,106,5,2025-11-07,3,Zes afmaken iedereen idee soms.
94,142,4,2024-01-05,2.5,Bruiloft vaak restaurant luisteren rots.
95,21,5,2024-04-08,2,Deksel oor we avond dan rapport.
96,99,3,2023-07-27,6,Vroeg pistool gemak punt afgelopen poort.
97,48,3,2026-05-08,4,Vast boom peper vergelijking.
98,13,7,2023-12-06,7.5,Vanmorgen boven min.
99,128,5,2025-01-16,7,Gaan uitvinden leeftijd vakantie zoet rots.
100,92,8,2025-07-08,2,Bui sap nooit hond zeker.
101,134,5,2024-02-02,3.5,Tante ouder hut bui.
102,48,4,2025-02-21,6.5,Suiker draad keuken.
103,15,8,2023-10-11,8.5,Leven week bad boord.
104,36,5,2025-01-30,6,Per terug afhangen mengsel aarde dun blij.
105,82,8,2023-06-21,8,Volgende lach vaak tekenen schijnen extreem.
106,27,4,2025-11-17,2.5,Nacht kunst wij pen.
107,121,1,2025-07-12,3,Overeenkomen snelheid per.
108,72,7,2025-03-22,6.5,Plattegrond thee ja.
109,9,6,2023-06-17,3,Offer effect zonnig.
110,43,3,2023-07-22,8.5,Pistool verzamelen zonnig.
111,41,8,2023-03-20,3.5,Fruit tegen reeds grijs eigen trui.
112,22,1,2025-07-07,6,Min dochter wat begrijpen kast feest.
113,123,2,2024-06-08,2,Huren uitzoeken taal bank.
114,36,1,2024-08-13,2.5,We dromen tijd.
115,18,2,2024-05-03,4.5,Moorden best geit liggen oor laken.
116,150,4,2025-10-20,6,Gedrag breken gebruik geliefde kunst.
117,1,6,2023-10-22,3.5,Kist gaan mama melk.
118,54,2,2024-05-07,6.5,Dat weg los knie correct.
119,148,1,2025-12-08,3,Poort zilver erg cadeau.
120,13,7,2025-03-10,8.5,Bel correct verschil luisteren drie ijzer.
121,104,2,2025-02-03,3,Pan toename praten peper.
122,98,3,2024-12-07,2,Oom object gebruiken kunnen.
123,51,8,2023-04-01,3.5,Met zus orde vergeten groente staal.
124,40,2,2025-09-07,7,Genot lepel gebeuren weg.
125,60,1,2025-07-26,1.5,Waarom vragen lachen.
126,92,7,2024-02-13,1.5,Bad mama team.
127,11,4,2026-01-17,4.5,Laten kom vader.
128,97,5,2024-08-08,3,Lood geluid olie.
129,126,7,2023-09-12,8.5,Schip kracht fris.
130,54,8,2025-06-19,4.5,Hard publiek blijven meel hem.
131,24,7,2025-10-15,3.5,Vertellen stom als los teken.
132,88,6,2023-06-11,4,Een vinden plat signaal aanbod.
133,88,5,2023-07-30,1.5,Best vork huis antwoorden laten goedkoop winter.
134,49,8,2025-07-02,6.5,Oog falen sap plaatje hut werelddeel.
135,103,7,2024-12-20,4,Winnen rok volgorde breken kasteel plaat.
136,21,7,2024-07-16,7,Kat punt simpel om telefoon.
137,9,3,2025-01-14,6,Zoeken gelijk broer.
138,19,4,2025-06-16,1,Stem structuur vinden sex student tafel.
139,10,3,2025-01-20,3.5,Jong god rubber groeien beneden.
140,128,2,2025-07-10,3.5,Lood missen verdienen mama nemen.
141,116,6,2026-03-21,2.5,Vrede lomp kennis ring schip zitten.
142,8,3,2024-07-24,2,Eenzaam voetbal blauw.
143,35,5,2025-10-19,6.5,Vraag haast zacht breed grens.
144,64,5,2024-06-17,7.5,Miljoen vlag naam.
145,40,2,2025-10-02,2,Alleen lach ruimte wereld manier lamp stem.
146,26,6,2025-07-14,2.5,Half belofte vinden.
147,87,5,2024-12-12,7,Vergelijken naald hut oom.
148,106,4,2023-11-19,7,Mengsel repareren nek normaal luisteren.
149,72,8,2023-09-06,2,Compleet toename drie gezicht melk ziekenhuis.
150,136,3,2023-02-23,3.5,Deksel grootmoeder zacht.
151,116,8,2023-06-26,1.5,We slot grootvader zij verhaal schijnen.
152,20,3,2025-12-12,4.5,Dom brug zulke.
153,131,8,2024-10-11,7,Buurvrouw gezicht een onder arm hoed.
154,53,3,2025-11-25,3,Deken links zilver netjes buiten.
155,36,3,2025-06-05,6,Koud minuut de.
156,95,4,2024-09-14,2,Weg dik ziekenhuis noord moeten.
157,22,5,2024-12-09,6.5,Manier hal winkel zoals.
158,37,5,2024-02-07,7.5,Rest tweede spreken wat ieder brief.
159,46,3,2025-12-28,1,Vreemd dag nul herinneren kort verhoging.
160,9,2,2024-11-22,8,Kaart hoogte pas einde natuurlijk.
161,63,7,2023-04-04,7.5,Einde bijzonder verrassen rook.
162,90,8,2023-03-04,4.5,Zilver kom meubel.
163,89,8,2024-05-16,8.5,Papier wind vroeger kant deken verspreiden.
164,47,8,2023-05-30,7,Klopt ademen ik herinneren lijk.
165,62,6,2025-05-01,4.5,Blauw sport liggen zuid uitnodigen haast.
166,101,7,2023-10-22,3.5,Spreken laat vergelijking overleden dapper.
167,150,2,2023-09-25,8.5,Map vies zonnig beroemd.
168,36,5,2024-10-15,2.5,Succes blazen kruis waarschijnlijk laat oefening.
169,28,1,2025-07-09,2,Stuk correct eend kleren oceaan bang.
170,76,3,2024-08-17,4.5,Vergelijken help olifant maan.
171,55,3,2024-11-01,6.5,Traan diep heet.
172,145,5,2025-10-17,6.5,Bus repareren haar dun vrijheid probleem.
173,114,8,2025-10-15,1,Bruin groeien zullen.
174,14,1,2024-05-08,2.5,Overvallen kant meer.
175,86,1,2024-07-30,4.5,Vijand plattegrond markt school bruin.
176,80,6,2023-08-09,4,Stap afname gewoon oorzaak deel maal.
177,117,1,2025-04-05,3,Kaart beetje kant.
178,106,5,2026-03-13,6,Bedreven half presenteren bezoek eigen.
179,84,2,2023-05-31,4.5,Echt boek structuur nog vinger veranderen sap.
180,109,6,2023-09-21,1.5,Graf schreeuw kantoor neus.
181,57,7,2026-02-16,3,Veer ademen na kind melk.
182,11,3,2025-10-21,1,Warm dood fout model verenigen.
183,132,3,2024-11-13,8.5,Perfect verenigen natuur net nummer succes.
184,94,3,2025-11-21,2.5,Lachen wakker brug.
185,99,8,2025-03-15,6.5,Water meel heuvel.
186,5,6,2026-02-26,3.5,Dag licht zoon nacht ziekenhuis.
187,121,5,2024-11-09,7,Sleutel andere van gebeuren.
188,80,4,2023-02-24,6.5,Scheiden herfst feest.
189,50,7,2023-04-16,6.5,Langzaam tand brengen.
190,10,2,2023-10-30,8,Televisie suiker bang.
191,93,7,2024-01-26,1.5,Antwoorden reeds ouder.
192,120,8,2023-11-07,4,Bruiloft gevaar beroemd restaurant studie thee.
193,63,6,2023-05-08,7,Examen vreemde een jij blijven verleden.
194,93,3,2025-09-06,6.5,Wit ja doen mis.
195,103,5,2025-07-30,6.5,Geluk ontdekken boord oom af foto.
196,84,5,2025-09-18,2,Zeker drie studie aap.
197,63,8,2024-04-05,3.5,We warm verschil.
198,83,5,2024-10-11,4.5,Kat opnemen lezen zak dus jouw.
199,116,6,2023-09-07,6.5,Langzaam moorden krant tak hobby.
200,86,2,2023-10-27,3,Breken cool tamelijk simpel offer.
201,140,4,2024-12-10,4.5,Bijvoorbeeld midden klok.
202,82,3,2024-02-18,8.5,Paard hier zingen liegen oceaan.
203,75,1,2023-08-12,6,Zon leeg versturen vorm.
204,15,2,2025-12-23,2,Wijn kennen ademen rok rijzen koning.
205,29,3,2025-04-26,3.5,Redden binnenkort dapper kopen oranje bord.
206,119,8,2023-01-11,6,Benzine zilver ieder over.
207,86,6,2025-09-04,7,Bureau vergissen spel groen smaak.
208,26,4,2024-08-07,7,Ouder succes u wind kaars rest.
209,51,7,2025-12-31,7,Zoon mond deken los bureau.
210,144,3,2023-12-27,1.5,Min plein controle boord beetje bescherm.
211,89,2,2024-08-15,1,Zien kleur roze.
212,144,3,2024-11-17,3.5,Helft plank tafel.
213,56,2,2025-10-29,4.5,Te tram enthousiast reizen meubel gezond.
214,78,3,2024-11-08,2.5,Vader noch afname tand zou.
215,88,4,2023-01-29,7.5,Klimmen hobby klaar.
216,124,6,2023-12-26,6.5,Auto droog reeds terwijl vogel.
217,54,3,2023-06-27,4,Mevrouw controle sneeuw mensen.
218,2,5,2025-09-04,3,Ontsnappen meubel oceaan.
219,81,6,2025-02-24,2.5,Ontvangen markeren verstand moeilijk koffie mij.
220,79,6,2024-09-10,6,Piano jong zinken hoewel andere.
221,136,5,2024-04-28,1,Chocolade kat vader.
222,35,5,2023-11-24,4.5,Altijd voorzichtig iets boom in kaart.
223,67,3,2025-01-22,6,Behalve gemeen gehoorzamen hier binnen.
224,109,7,2025-09-06,2.5,Vijand broek draaien.
225,76,2,2026-01-29,4,Hoogte maag verzameling ontsnappen vreemde glimlach.
226,21,2,2025-12-12,4.5,Openlijk zonder klas koffer ontvangen vaarwel.
227,45,3,2023-05-07,8,Schetsen examen miljoen.
228,34,4,2024-11-02,8.5,Doos heel ziek enthousiast postzegel.
229,149,8,2026-04-09,4,Verhoging niet haar.
230,150,7,2023-04-24,4,Haten ontwikkelen uitvinden.
231,134,5,2025-07-24,6,Stil bloed verlaten boek huur beroep.
232,1,4,2023-02-14,4.5,Markeren feest trouwen radio helder uitvinden.
233,123,6,2026-03-30,1,Rekenmachine hij laat gespannen morgen.
234,19,8,2023-05-11,6,Dus afspraak signaal verzamelen ooit fijn.
235,53,3,2023-03-06,3.5,God praten vaarwel verschrikkelijk vrijheid.
236,130,7,2025-05-10,3.5,Spelen bel enkele maaltijd geluid stoffig.
237,102,2,2025-02-08,1,Verlaten kuil verwachten vuur.
238,37,4,2024-01-01,6.5,Verleden glimlach haar doen.
239,89,8,2023-01-08,8,Geld gelijk delen ander tuin het.
240,70,4,2026-01-20,4.5,Olifant les provincie avondeten dochter correct.
241,83,4,2025-08-01,3,Toename groeien nul probleem.
242,5,4,2023-08-20,1.5,Zeil meneer afval.
243,10,8,2024-02-27,1,Hij haten beneden.
244,75,1,2026-05-09,7,Vouwen rijst vol koning verhaal.
245,65,1,2025-04-03,4,Geld ontdekken mis.
246,71,6,2023-10-14,6.5,Naar verder wolf.
247,72,5,2026-03-28,6.5,Gespannen vogel gelijk bureau uur hotel.
248,120,5,2023-10-21,7,Stem uitzoeken stilte wetenschap fris boven.
249,124,8,2024-07-17,1,Ziek lezen gevaarlijk opnemen.
250,94,7,2023-04-07,3.5,Netjes schrijven brief nooit map genoeg.
251,110,3,2025-04-16,2.5,Voeden wie kantoor sneeuw.
252,68,5,2026-01-06,4,Algemeen zes papier verjaardag.
253,16,7,2023-10-23,8.5,Schetsen toen geloof.
254,113,4,2025-05-03,6,Klok presenteren schudden vriendelijk schaap neus.
255,22,8,2024-06-06,2.5,Vertellen knippen vrouw kok.
256,15,5,2025-01-29,1,Heet wie succes haten.
257,20,4,2025-02-11,7,Wachten politie voeden taxi.
258,140,4,2026-04-18,7,Toename gras bijna terwijl mevrouw.
259,64,4,2024-11-12,3,Weer huis lang want boos.
260,75,4,2023-08-29,7.5,Schreeuwen moeilijk jij pagina.
261,85,7,2025-03-23,2.5,Stem lopen ander beetje prinses poes.
262,91,5,2025-08-12,6.5,Aanval enkele hemel.
263,136,2,2025-01-06,6.5,Bijvoorbeeld ding munt ziek verdrietig tand.
264,62,6,2025-08-19,8.5,Schaap tram hoeveelheid medicijn steen gezicht.
265,67,3,2024-10-02,4,Veranderen tweede elk laat duur vlieg.
266,88,3,2023-02-03,3.5,Gebied wit water publiek plat vrijheid.
267,111,4,2024-02-06,3,Elk seconde draad kort leerling.
268,78,8,2025-10-19,6.5,Delen zand dragen ons.
269,103,3,2025-10-01,4,Snijden leren wapen.
270,54,1,2023-10-14,7.5,Verandering mij gebied eten winter.
271,14,1,2025-12-09,1,Haar mij comfortabel versturen.
272,19,3,2025-04-24,2,Fles veilig spelen eerste dus tram.
273,109,1,2023-01-19,2.5,Halen gezond pijn.
274,5,1,2025-09-16,7.5,Keuken sap luisteren actief.
275,4,1,2025-12-25,6.5,Vinden zijn koningin.
276,86,1,2025-12-20,7.5,Smaak slecht stelen geven.
277,52,2,2025-10-25,8.5,Of beetje wereld.
278,74,4,2023-07-17,6,Vroeger zwaar wijn zetten overvallen stop.
279,81,7,2025-12-14,3.5,Aardappel modern klein.
280,133,4,2023-06-11,3.5,Rijst computer voorzien bal dun.
281,10,2,2024-04-07,3,Model wens vliegtuig compleet.
282,139,1,2025-04-10,4.5,Slim lenen gezicht hij zitten.
283,24,8,2023-01-20,7,Vinden vergelijken stom weer grond vlieg.
284,28,1,2025-06-07,7.5,Verdienen weer munt leren door stelen.
285,82,1,2024-04-15,2.5,Tand deze verspreiden rechtvaardig tussen begin.
286,10,3,2023-06-02,7.5,Begrijpen echt mama.
287,42,7,2024-10-06,1,Sinds les zus weg.
288,74,7,2023-06-07,3,Licht zorg om.
289,41,2,2026-01-12,3.5,Middel verleden vierkant buren bodem.
290,15,2,2025-10-22,7.5,Dus draad mogelijk grap.
291,100,7,2025-06-14,2,Fijn zwembad aap taxi dus warm.
292,131,8,2024-10-30,1.5,Team rood volgorde alsjeblieft.
293,125,3,2024-04-12,3.5,Kom oranje wonder.
294,24,5,2026-04-14,7.5,Dienen bijten verdrietig reeds los.
295,24,5,2024-05-19,7,Over aardappel ziek rechts.
296,113,6,2023-11-12,4,Hoofd stad station zak ontbijt.
297,2,5,2025-01-08,1,Verzameling uit grond tussen.
298,31,3,2025-06-29,3.5,Noot pagina bloem.
299,130,7,2023-06-28,2.5,Dubbel zelfde vier blij.
300,103,2,2023-07-31,1,Donker terwijl grootmoeder structuur.
301,112,1,2026-05-07,6.5,Bui meubel lenen.
302,24,4,2024-08-20,4.5,Vriendelijk pan kamer boete.
303,111,3,2026-03-17,6,Mooi met vol markt onderwerp.
304,81,8,2023-10-12,3.5,Blijven lang kennis eend poes.
305,126,5,2023-10-26,1,Bad iets maan.
306,21,6,2025-05-12,3.5,Publiek smaak wens nee.
307,57,8,2024-05-30,2.5,Bijzonder maken bij uit heet zon.
308,2,7,2023-08-08,2.5,Verjaardag nacht hard bedreiging.
309,97,8,2024-11-11,8.5,Wanneer moord moment.
310,89,6,2024-11-16,4,Boek regen ontsnappen gevaar gevaarlijk.
311,140,6,2026-05-20,7,Team afmaken sterk.
312,87,8,2023-12-30,4.5,Dun duwen kok bijzonder vlieg.
313,96,7,2026-03-25,8,Hij speciaal suiker lip.
314,107,2,2024-07-28,8.5,Iets want vak fel.
315,8,8,2026-02-28,2,Stom papa vinden.
316,19,7,2024-03-05,4.5,Lengte afname kom.
317,74,5,2025-10-19,2.5,Drie me schieten.
318,110,2,2023-11-12,7.5,Spel helft vals piano schetsen zeil.
319,117,7,2025-07-08,6.5,Uitvinden blauw cool eeuw vandaag.
320,24,2,2026-01-18,1.5,Vertrouwen feest punt raak.
321,49,1,2024-05-23,7.5,Verkeerd vertrekken nieuws blad teen.
322,97,7,2026-02-27,7.5,Manier algemeen doos.
323,79,4,2023-08-05,1,Stempel lijk meneer.
324,130,6,2025-11-11,7,Vertrouwen opeens enthousiast.
325,101,1,2025-03-12,4,Verdienen koffie hun borstelen vernietigen leiden.
326,121,2,2025-09-15,1.5,Veroveren stem overal ochtend halen.
327,102,5,2023-08-26,8,Kop moord speciaal wetenschap vrij vies.
328,141,6,2024-12-03,4,Smal neer lang hoe.
329,131,6,2025-09-02,1.5,God punt voorbeeld.
330,34,1,2023-05-18,3,Mij wij instrument.
331,49,4,2024-12-03,7,Al haast ei ijzer geel.
332,97,7,2025-11-22,2,Openlijk sap wassen verspreiden.
333,54,3,2025-08-04,2.5,Compleet hamer slot zee vergelijkbaar.
334,57,8,2025-06-04,4,Trouwen tweede verlaten plaats grond.
335,2,4,2026-04-27,4.5,Restaurant cirkel en.
336,31,3,2024-02-26,3,Middel trein wind midden gehoorzamen of.
337,133,2,2025-01-19,3,Kaas gezicht rood.
338,93,7,2024-06-21,7.5,Verandering vorm antwoord beneden.
339,102,6,2025-03-14,6,Broer geboren oma mengsel zulke.
340,89,2,2025-07-26,6,Teen tegen offer vouwen verspreiden.
341,74,5,2023-10-02,3,Papa bot beer winter tussen zeggen.
342,42,7,2023-08-28,2.5,Zijn tevreden passeren.
343,112,7,2025-05-06,6,Veer bal bouwen.
344,49,8,2024-01-16,4,Bruiloft examen kant spreken slecht tak minder.
345,93,8,2024-08-14,2,Diep kap varken.
346,3,8,2023-04-20,8.5,Veroveren lezen laatst.
347,148,8,2023-10-07,2.5,Genieten vader iets.
348,121,8,2025-04-17,7.5,Drie glimlach sneeuw laatst plus genieten.
349,9,4,2025-09-27,2,Land gebruikelijk uit laag kruis luisteren.
350,68,5,2024-08-21,1.5,Trekken kant anders de achter uur.
351,144,2,2023-12-11,8.5,Binnen hobby zoeken.
352,107,1,2026-03-18,1.5,Lepel koken avondeten wat.
353,123,2,2025-06-22,6,Vriend beide politie.
354,131,5,2024-05-21,3,Zien laken vol schudden vis soms.
355,127,2,2024-12-14,8,Vrouw aardig groente nee warm.
356,124,3,2024-04-30,2.5,Lijken examen nood toen raken.
357,62,1,2023-10-13,8,Volgorde tevreden koud elektrisch helder.
358,50,6,2026-03-13,3.5,Nieuw koers snijden.
359,150,2,2024-08-22,3.5,Naam noch film.
360,17,5,2023-10-05,8.5,Nummer naar suiker doen ander trui.
361,76,3,2023-09-17,7,Gewicht verf help lang moeder stad.
362,114,8,2024-10-21,8,Gewoon moeten buren succes wild.
363,121,7,2023-10-19,6.5,Haten stelen lopen zoet uitzoeken.
364,118,5,2025-07-14,1,Oneven vorm plattegrond netjes overal jas.
365,96,1,2025-01-25,4.5,Rest vandaag ontvangen dag.
366,104,2,2023-07-10,7.5,Naald genot hoop oost veel.
367,124,4,2025-12-30,4,Los deel laten kunst bloem.
368,85,6,2025-10-10,3.5,Voor markt lijken keuken natuurlijk.
369,142,6,2026-01-25,6,Olie terugkomst vinger opa potlood zwaar.
370,133,1,2023-04-10,1,Stad lach donker moeder melk lui.
371,127,8,2023-09-12,8,Verzameling bruiloft fijn manier stoffig winkel.
372,38,5,2023-01-02,4,Wassen bruiloft verschrikkelijk breken keuken.
373,27,6,2023-11-22,8.5,Bad dienen kiezen zout.
374,49,1,2024-05-27,1.5,Hamer ander dansen thuis.
375,71,7,2025-03-22,7.5,Bedreven vorm voorbeeld fles varken.
376,1,4,2023-07-06,7,Aanraken noot beroep basis meerdere hert.
377,68,8,2025-09-03,1,Vreemd tevreden markeren sok papier.
378,35,7,2023-01-20,1.5,Modern maag lip.
379,70,7,2023-09-28,4,Deksel sport blij plant plank.
380,31,6,2023-07-02,7,Geel komen noch zand voorkomen.
381,111,3,2025-01-22,3,Product vier slapen ontmoeten.
382,49,8,2023-10-20,1,Oma buren olifant ei.
383,45,7,2024-12-20,7,Nodig suiker zak naar straat mits.
384,26,2,2025-06-25,8,Bui wie dun.
385,112,6,2023-10-14,8,Gras examen verdienen.
386,76,5,2025-05-29,3,Liggen uur park kort basis verwijderen.
387,8,5,2023-06-22,2.5,Iedereen dus als.
388,114,5,2024-02-25,6,Hoek gevolg broek boord draad dat.
389,144,7,2023-04-22,8,Team diep woord rots.
390,20,1,2023-08-19,2.5,Periode hoog ander.
391,113,7,2025-01-09,3,Hebben boon dansen.
392,138,2,2025-01-18,6,Gevolg wild vrede beest geloof.
393,4,5,2023-02-04,6,Open middel structuur kloppen brood belangrijk.
394,116,5,2024-03-17,1,Oceaan berg andere populair waarom.
395,123,7,2025-10-23,8.5,Goedkoop zeil rond.
396,84,2,2023-06-18,7,Tamelijk radio buurman ontsnappen.
397,46,6,2024-09-26,1,Bijzonder postzegel eten zetten kind.
398,92,7,2025-03-11,6,Thee nieuw langs vuur.
399,26,7,2024-05-03,1,Bal vallen zeer plaatje rapport.
400,92,3,2023-08-26,4,Aan werk meest overleden.
401,3,3,2023-09-02,1,Zwemmen verkeerd fijn verhoging grof.
402,49,6,2025-10-13,3.5,Ster onderwerp heet komen.
403,35,1,2023-09-17,7.5,Verdrietig spel zwembad.
404,82,2,2024-11-17,8.5,Feit modern uitleggen voetbal winnen.
405,145,8,2024-06-22,7,Zo slapen grappig reizen.
406,145,3,2025-11-12,3,Iets lunch paar afhangen schieten.
407,31,2,2025-01-23,2.5,Pas aap achter.
408,13,1,2024-04-12,7,Laag vos signaal tamelijk.
409,107,7,2024-05-15,1.5,Bijten vlieg radio nieuws voorzien vangen.
410,122,4,2023-11-04,2,Rijzen jong vallen verandering kaart.
411,94,5,2024-10-21,2.5,Verhaal vakantie zomer bus.
412,35,1,2023-06-09,6.5,Wie liggen gat afval grof.
413,117,2,2024-01-03,2,Effect vangen plastic vaarwel gat.
414,92,6,2025-08-10,8.5,Zetten avond middel simpel park aardig.
415,3,6,2023-06-26,6.5,Breken groeien mis dragen eigen.
416,75,8,2024-02-15,3.5,Rijzen pagina dromen opleiding stof cadeau.
417,57,4,2025-01-24,6.5,Verstoppen voelen spreken gras vernietigen alles.
418,8,4,2023-11-05,1.5,Periode rubber voetbal aanbod leeg ring.
419,98,1,2026-01-14,3,Verspreiden honderd verlaten.
420,31,4,2025-02-09,8.5,Gras rubber maat kant taart.
421,143,1,2025-12-21,2.5,Bedekken want net hoed.
422,27,1,2023-10-19,7.5,Eiland bijten ontmoeten alsjeblieft stem.
423,109,8,2024-04-19,8.5,Zak wakker eis hotel belofte.
424,148,3,2023-06-23,6,Boete meel vaarwel oud plat huren geschikt.
425,126,3,2025-03-18,1,Manier zand verf.
426,93,7,2024-04-29,3.5,Naald geld beter paar leven.
427,82,4,2024-10-30,3.5,Plastic oom binnenkort.
428,32,3,2023-06-02,2,Wakker klas voorkomen.
429,136,6,2023-08-05,2.5,Thee belofte uitleggen.
430,63,8,2025-04-12,1.5,Helder plat berg.
431,35,2,2024-09-23,4.5,Olifant hand kleren.
432,12,4,2023-11-19,8.5,Pijn kunnen vet.
433,76,6,2024-11-02,2,Actief klimmen trouwen voeden plaat iedereen.
434,89,5,2025-03-22,6,Los horen ei.
435,131,4,2023-12-23,1.5,Ademen smaak oud.
436,41,2,2023-07-13,4,Vriezen buurman mogelijk jullie.
437,38,4,2023-01-25,1,Speciaal liggen gemakkelijk tuin belangrijk heuvel.
438,79,2,2025-03-31,3,Moord radio kaart op nodig.
439,128,3,2023-02-14,1,Deken herinneren ijs.
440,36,1,2023-07-08,8.5,Ziekenhuis muziek rechtvaardig dat geliefde.
441,125,7,2025-08-02,1,Vertrekken lang einde enkele vroeger tijd.
442,124,3,2025-10-13,1.5,Eerste markeren schieten machine schijnen.
443,83,5,2024-12-25,2,Ongeluk hut heel horen bot vlieg.
444,75,5,2025-07-02,2,Mijn wapen presenteren.
445,17,2,2025-10-18,4.5,Maat film meer team.
446,122,4,2024-07-26,4,Vaak kist kopen veranderen aarde.
447,111,6,2025-12-12,2,Bevatten angst brood.
448,101,6,2025-09-09,6.5,Lichaam politie waar kamer.
449,8,6,2025-03-06,3,En grootmoeder fris.
450,84,1,2026-05-07,2,Snijden iedereen ochtend dubbel.
451,71,3,2025-08-24,6.5,Droog gezond bord.
452,81,1,2023-07-25,2,Klasse toekomst breken.
453,103,3,2024-03-25,6.5,Hemel geluid vader regen.
454,104,1,2023-12-27,2.5,Zinken zwak voelen vloer berg dat.
455,55,8,2024-12-21,6,Trekken effect klasse.
456,143,1,2026-01-15,3,Hoek leeuw potlood wassen tand.
457,67,1,2023-07-04,1,Eerste niet toename hoop begin trouwen.
458,97,4,2025-12-14,4,Verschil zeven vol.
459,95,1,2023-09-25,3,Sport tien totaal periode.
460,33,6,2023-02-14,2,Mogelijk straffen product mogen.
461,29,6,2023-05-29,3.5,Na dubbel sluiten natuur meisje zaak.
462,47,7,2024-09-10,3,Goed kopen wassen op avond fruit.
463,51,6,2025-09-24,7.5,Lood gehoorzamen fris laten.
464,110,5,2024-04-02,7,Ontmoeten wetenschap kip nul controle.
465,1,7,2024-08-26,2,Hard na gedrag.
466,94,4,2026-03-08,1,Maar plaats leeftijd.
467,42,6,2026-03-04,1.5,Lenen kennen min grappig als.
468,94,3,2023-06-09,2.5,Geen product kamer bijvoorbeeld verkeerd.
469,130,1,2023-07-01,8.5,Noord bieden grijs gebruik bruiloft kans.
470,19,6,2024-06-27,2,Enkele eis hotel helft vandaag samen.
471,1,1,2024-06-09,8,Eeuw papa daar verstand.
472,49,7,2025-03-01,4.5,Waar acht heel veel thuis kosten.
473,110,2,2025-10-06,4.5,Vechten suiker activiteit recht zorgen.
474,48,8,2025-09-08,8,Vier gebruik sorry.
475,88,1,2023-05-31,8,Map morgen tijd suiker.
476,20,6,2024-10-14,3,Iemand binnenkort verleden leerling wild.
477,21,2,2023-12-15,4,Feest lip olie kip ook.
478,9,7,2024-11-23,6.5,Hemel stem minuut.
479,47,1,2023-12-04,6.5,Iedereen laken schaap kosten terugkomst.
480,55,7,2023-07-27,3,Heel open ons antwoorden dag zinken.
