uur_id,project_id,medewerker_id,datum,uren,omschrijving
2375,62,8,2024-08-23,1,Jas arm koningin vroeg nummer lunch.
2376,74,3,2025-07-29,2.5,Eenheid partner toekomst bui moeder dit.
2377,97,3,2025-08-02,6,Kleren boon mevrouw dier.
2378,2,1,2024-05-16,4,Jouw verleden veer.
2379,112,2,2025-04-12,8.5,Gebeuren zeggen rook poort duwen blij.
2380,8,8,2025-05-04,3,Rest verjaardag lepel slapen gif vertrouwen.
2381,87,7,2025-09-11,8,Medicijn hoofd student compleet feest.
2382,149,8,2023-03-23,3.5,Zoet zoet dan dom.
2383,31,3,2025-05-27,8,Afmaken boven partner gevaar dienen om.
2384,50,6,2024-06-21,8,Diep vandaag zou politie een station.
2385,42,4,2025-04-25,7.5,Kraam klas vechten pijn zulke.
2386,28,6,2025-09-15,2.5,Kiezen been koers vergelijkbaar.
2387,75,5,2023-06-01,4.5,Vet gemeen verstoppen broek begrip koning.
2388,97,8,2024-12-02,3.5,Grens verandering aarde richting gebruiken olie.
2389,11,3,2024-06-12,6.5,Tekenen rapport honger af.
2390,8,4,2023-10-31,6.5,Fruit kloppen kort.
2391,87,5,2025-01-29,6.5,Mogelijk haan kop.
2392,139,8,2023-11-21,6.5,Verder manier kasteel beneden staal totaal.
2393,43,5,2024-08-26,2,Kant gespannen beter.
2394,9,4,2025-02-25,3,Wie reeds kennis leerling.
2395,4,5,2026-04-09,3,Beter ongeluk want ijs.
2396,140,3,2025-01-15,7.5,Graf ontbijt rijk ooit kist.
2397,146,6,2024-12-05,7,Oranje list miljoen uitvinden.
2398,142,3,2025-12-07,3.5,Me aan daar.
2399,141,7,2025-12-11,4,Draad zingen rest betalen.
2400,100,4,2023-01-30,7,Boete spreken blij herfst wijs ontmoeten.
2401,45,5,2024-09-25,2,Vrij plaatje maaltijd ongeluk lopen.
2402,104,8,2023-09-02,7,Ongeluk nacht fles.
2403,70,4,2025-07-29,6,Leeftijd vork gedragen tuin.
2404,117,2,2025-01-14,7,Compleet raken rok andere.
2405,82,2,2024-11-05,6,Schoon zeil neus markeren nood.
2406,75,5,2023-04-25,4,Geliefde praten familie poes ontmoeten.
2407,70,8,2024-01-10,7,Eten pagina plus kleur.
2408,84,2,2023-12-30,1.5,Eenzaam woud rijzen tijd.
2409,38,5,2024-01-25,7,Duur bus bed buiten beslissen.
2410,75,8,2023-05-05,2,Televisie mengsel klasse.
2411,94,2,2025-08-08,1,Onderwerp lucht wassen meel.
2412,128,2,2024-02-07,4,Aanbod lamp oma.
2413,65,8,2025-09-01,2,Hen nood tamelijk miljoen haten.
2414,125,2,2024-09-06,6,Ouder water vogel blij vangen.
2415,132,1,2025-06-25,8,Voorkomen leeftijd zou geven houden.
2416,82,8,2024-05-30,8.5,Kracht jongen schrijven.
2417,150,5,2023-12-28,3.5,En opleiding klopt grap leeftijd eend.
2418,100,5,2024-09-05,3,Licht breed positie raam daar.
2419,127,2,2026-02-23,6.5,Gebeuren examen school ouder soep.
2420,94,8,2024-01-09,4,Kennis breken negen maaltijd.
2421,18,7,2025-10-12,2,Leeftijd gehoorzamen bieden hobby.
2422,100,3,2024-09-15,1.5,Wakker plaatje olifant ontbijt.
2423,71,4,2024-02-01,8,Peper jaar grof rechtvaardig gerecht.
2424,94,8,2024-09-21,6.5,Student vlag willen hallo gat.
2425,63,3,2023-07-30,7.5,Tijd traan hemel buiten.
2426,116,3,2024-10-25,2,Welke opnemen structuur gemak sinds vertellen.
2427,96,8,2023-11-20,6,Oom grootvader onze goedkoop.
2428,81,4,2026-05-04,8.5,Gisteren natuur rood rechtvaardig oma.
2429,108,3,2024-06-22,4.5,Gebied ouder mis.
2430,93,8,2024-09-19,3.5,Papier me wetenschap.
2431,121,1,2024-09-22,4.5,Richting netjes tegen naast vertrekken goedkoop.
2432,103,3,2025-04-07,1.5,Ding zetten zwak tafel.
2433,5,4,2025-07-24,8.5,Cirkel schieten brood medicijn bank.
2434,88,6,2024-03-03,7.5,Helder verschil ja haar sleutel.
2435,111,6,2023-02-18,3.5,Keus mand opeens vertrouwen buurman.
2436,65,8,2026-02-16,6,Actief helder ongeluk veroveren.
2437,75,3,2024-07-15,1,Welke deksel pen ongeluk veel.
2438,138,1,2024-10-28,7.5,Vraag vlag boven.
2439,76,5,2025-03-09,7.5,Even verzameling hun.
2440,29,1,2026-04-15,4,Vet neer over eeuw oost.
2441,127,5,2024-12-02,3.5,Rook man aanraken wijn ziekenhuis bieden ontwikkelen.
2442,20,6,2023-08-16,4,Winkel gezond kans hebben.
2443,45,5,2025-04-27,8,Schoon koning gat beter.
2444,127,4,2026-03-21,2,Nul bedreven even voorkomen eeuw krant.
2445,87,1,2024-11-02,6.5,Appel gerecht het.
2446,93,6,2023-10-15,8,Echt kracht rechts afspraak.
2447,54,6,2025-07-02,7,Rekenmachine smal laatst steun.
2448,106,6,2025-08-17,2.5,Tevreden noch andere object vreemde.
2449,78,1,2024-02-12,7.5,Slim vraag ontbijt groep student.
2450,124,7,2023-10-15,1.5,Dichtbij uitvinden blij.
2451,17,6,2025-09-23,8,Leven haan maar eenzaam avondeten falen.
2452,10,6,2023-02-03,6.5,Beker gebruikelijk trein vergelijken wissen.
2453,98,2,2026-01-08,4.5,Dom olifant winkel lang.
2454,33,3,2023-06-04,6,Duur straffen springen student taal.
2455,136,4,2025-11-17,8,Enthousiast naam dienen trein.
2456,83,8,2023-05-30,8.5,Correct controle kort.
2457,97,2,2025-07-13,7,Fles vliegtuig gebruiken.
2458,132,7,2024-01-08,7.5,Elektrisch krijgen lichaam station.
2459,2,7,2023-02-13,4.5,Rijk leeg lucht.
2460,95,7,2023-02-08,1,Leuk leeftijd tellen.
2461,96,8,2023-11-05,3,Passeren straat hoe vragen behalve groeien.
2462,46,4,2024-02-15,8.5,Feit bieden vriendelijk vullen station.
2463,53,2,2023-10-31,2.5,Teen vangen dragen anders goud wanneer.
2464,37,6,2023-02-23,6,Bedekken noch luisteren.
2465,70,4,2023-05-22,3.5,Vader tuin wanneer afmaken los dood.
2466,123,5,2024-02-18,3,Reiken computer beetje kind.
2467,8,3,2024-04-22,2.5,Van soort wakker gewicht voetbal.
2468,8,8,2025-06-19,1.5,Springen zand verenigen markt potlood.
2469,130,8,2024-03-03,4,Hond gezicht bouwen titel paard verzamelen.
2470,111,2,2025-03-28,2,Beer kamer nodig niets.
2471,48,4,2023-07-10,2,Diep rook plein iedereen vinger.
2472,94,7,2023-09-04,4.5,Dun hoed bad.
2473,148,6,2024-01-27,2,Tevreden ijzer kom netjes sluiten waarschijnlijk.
2474,132,1,2025-09-05,3,Wissen meneer plattegrond.
2475,117,2,2023-01-15,4.5,Ontwikkelen wijs trekken boord binnen.
2476,18,7,2024-12-27,3.5,Bruin lui moord.
2477,113,8,2024-09-07,2,Schouder zoet object vaak.
2478,13,3,2023-02-02,3.5,Been wakker zilver bevatten verstoppen verzamelen.
2479,37,3,2024-05-24,2,Half avond plus geboorte deze bos.
2480,11,1,2023-10-15,7.5,Pijn school dubbel hoeveel vol tante.
2481,88,6,2026-05-06,8,Borstelen dromen vrij winnen stop gereedschap.
2482,122,3,2025-04-29,8,Los dood kans hal dat kist.
2483,53,6,2023-12-24,6,Roze schaap gezicht voeden kleur.
2484,9,8,2023-08-13,8,Vroeger sterk aanbod nobel.
2485,109,5,2024-02-22,3.5,Erg hal helft vliegtuig.
2486,97,1,2024-10-19,1,Hem verhoging minuut.
2487,119,1,2025-08-21,1,Oorlog houden goud al doos verwachten.
2488,47,2,2026-01-09,4,Samen tas sap betalen taxi hij.
2489,27,7,2023-01-31,3,Miljoen plank vriendelijk koningin positie.
2490,134,7,2023-05-16,1.5,Dochter vliegtuig steun laat.
2491,1,5,2026-01-04,4,Een wassen map trekken.
2492,37,6,2025-09-02,4.5,Waar ons afname bijna.
2493,140,8,2026-01-10,3,Jagen bijzonder vader conditie recht.
2494,67,3,2026-03-15,2,Spel ding oud bruikbaar honderd vet.
2495,28,7,2023-10-20,2,Fris deze hoek suiker seconde.
2496,76,4,2024-08-01,6,Geel gemeen resultaat vallen product.
2497,97,8,2024-05-28,2.5,Veranderen soort rennen woud.
2498,38,6,2026-04-24,6.5,Leiden bewolkt rekenmachine.
2499,10,7,2025-05-14,3,Moorden provincie nummer boom even boven.
2500,53,1,2023-04-09,8,Tafel bad grap neus vers simpel.
2501,72,3,2023-10-20,7,Benzine privé droog deze.
2502,141,8,2025-03-23,3,Thee kijken hart reizen.
2503,131,4,2024-12-05,2.5,Slot nieuws vijf.
2504,127,2,2025-07-17,6.5,Lachen minuut kort vork bos oost.
2505,99,3,2024-07-26,7.5,Hoogte of beker hert hemel conditie.
2506,132,2,2024-06-06,3.5,Bang knippen ontdekken.
2507,18,6,2024-12-02,8.5,Wachten min presenteren meer verenigen naam.
2508,37,2,2025-05-23,7,Praten grof vijver stop tellen.
2509,35,5,2024-04-10,4,Overal speciaal fout.
2510,91,8,2023-09-16,8.5,Brengen dak wens vaarwel.
2511,148,3,2025-06-12,6,Bewolkt echt hemel beneden.
2512,42,4,2025-03-25,8,Dood geur foto zien.
2513,45,1,2023-02-04,2.5,Stap wiel wanneer ontsnappen.
2514,49,6,2025-12-27,3,Blijven verzamelen lijken.
2515,68,3,2023-11-22,1,Opleiding over per oog natuurlijk.
2516,60,5,2026-01-12,6.5,Moord en steen afval.
2517,113,7,2023-04-11,4.5,Vlees lang al scheiden.
2518,40,5,2025-09-02,4.5,Slaapkamer belofte ja eis.
2519,92,4,2023-01-01,1.5,Nobel eigen koning vinger.
2520,120,3,2026-05-01,1,Hond bedekken vader.
2521,75,7,2023-10-22,4,Gemeen negen gehoorzamen sleutel.
2522,114,4,2023-11-23,7.5,Oceaan dom lachen vak dragen.
2523,20,4,2024-05-24,8.5,Te belofte lomp netjes lenen veel.
2524,36,3,2024-07-19,2.5,Werk vertellen druk oefening voorbeeld.
2525,83,6,2024-02-26,4,Passeren kloppen toename zee fit meisje.
2526,92,2,2023-01-23,7,Moeder positie voetbal.
2527,127,5,2026-05-10,4,Waarom straat te druk los genot.
2528,46,2,2023-09-13,6.5,Hem tennis aan bewegen dier moeder.
2529,111,5,2024-11-30,3,Enthousiast geboorte pas boord.
2530,124,3,2023-08-20,7.5,Verrassen stad gebeurtenis vraag maal paard.
2531,68,2,2025-09-24,8.5,Neer hoog wiel.
2532,74,8,2023-07-01,7.5,Kracht vos midden.
2533,31,5,2025-06-04,4,Raam lang plus.
2534,122,5,2024-07-18,3.5,Ver dorp positie west naast.
2535,29,8,2024-12-31,1,Genot bewolkt cadeau park.
2536,67,7,2024-05-12,6.5,Brug want school jong ouder.
2537,110,7,2024-06-28,1.5,Verspreiden proberen nodig hebben regen dubbel.
2538,29,2,2023-03-28,6,Zou vechten derde.
2539,106,7,2023-08-29,8,Klaar schoon vechten netjes tand.
2540,101,8,2025-03-17,7,Vijf onze boek honger even piano.
2541,117,7,2025-08-01,6,Oneven woord ijzer gebeurtenis grap leren.
2542,8,6,2023-02-22,2,Tand stempel volgende.
2543,9,8,2023-07-22,3.5,Verwijderen alleen goed markeren tante kunst.
2544,103,4,2024-06-03,3.5,Zorg hem tante onze koning algemeen.
2545,96,8,2024-07-20,4,Oceaan overal hen.
2546,63,6,2024-06-22,8,Gevaarlijk jij pijn ontdekken kraam bewolkt.
2547,51,8,2025-04-01,8.5,Eigen pas modern helft kuil gemak.
2548,70,6,2023-07-02,3.5,Na plus extreem start niets.
2549,118,6,2024-09-18,1,Boven klein tennis netjes glas hoed.
2550,111,4,2025-10-15,7,Doos prins uur vlees hoogte dragen.
2551,102,6,2024-06-26,8.5,Door dag luisteren.
2552,50,6,2025-06-15,3,Kopen object vreemde afspraak nood.
2553,92,5,2023-02-02,1,Neus geur naam tegen.
2554,116,2,2026-02-20,6,Of nobel oefening.
2555,118,5,2024-02-11,1,Hotel hemel van.
2556,103,7,2023-10-26,7.5,Geld overal manier vergelijkbaar stilte bouwen.
2557,88,2,2023-09-30,4,Laatst vier afgelopen week liniaal.
2558,12,4,2024-10-25,2.5,Wachten bedreiging fijn roze sok.
2559,8,8,2026-01-27,2.5,Bord voor terugkomst jullie eten.
2560,75,4,2024-04-04,8,Knie boom gezond oneven ver.
2561,43,1,2025-06-20,7,Rennen vraag hand links beest tak.
2562,141,8,2024-08-30,2,Rapport nek dom.
2563,120,3,2025-04-28,6,Antwoord politie even.
2564,113,5,2025-11-28,6.5,Voor bureau gedrag want help.
2565,125,6,2025-01-15,8.5,Compleet overal bank meisje.
2566,104,2,2025-01-16,2.5,Wreed olie welkom vannacht kip.
2567,37,2,2023-10-03,3,Wijn klas toekomst buurvrouw.
2568,93,2,2025-11-05,7.5,Vullen peper les me hoe.
2569,68,8,2024-04-11,7.5,Team een verstoppen bus aardig.
2570,133,8,2024-07-05,6,Fles postzegel reeds lezen.
2571,18,3,2025-10-15,6.5,Gewicht herfst vreemd.
2572,16,6,2023-02-15,6.5,Nodig sap hoog overleden.
2573,18,6,2025-09-03,8,Leuk dragen veroveren vanmorgen neus hier.
2574,77,1,2023-05-14,7.5,Verdrietig ziek haar spreken fris doos.
2575,40,7,2026-05-09,4.5,Behalve steun kom redden winter wens.
2576,92,5,2024-03-16,7.5,Welkom terwijl geld.
2577,42,6,2024-11-07,2.5,Populair maan ding.
2578,104,2,2023-01-14,6,Niets nooit genoeg instrument.
2579,120,3,2023-05-26,6,Sluiten hond hoofd dus resultaat.
2580,53,1,2024-02-03,2,Ruiken instrument sluiten hier.
2581,97,2,2025-10-10,7,Brood mits met periode links.
2582,119,7,2023-07-12,4.5,Hut beetje verschil.
2583,53,2,2025-08-29,2.5,Kap paar gewicht.
2584,125,5,2024-09-29,3,Herfst man tante presenteren kaars.
2585,79,7,2025-10-20,1,Haten vis stad.
2586,22,6,2024-02-15,2.5,Brief toename maal kaars.
2587,78,1,2025-07-14,8,Sex zo lunch gewoon.
2588,109,2,2023-05-05,6,Eten hun mes neus gebeuren bus.
2589,2,6,2023-12-12,1,Land vis bescherm enthousiast.
2590,109,2,2025-02-26,3,Want zoals leeg avondeten map neus.
2591,53,4,2023-12-20,2.5,Vallen of jong drogen.
2592,109,3,2024-12-08,1,Markeren achter verandering lepel hoe belofte.
2593,148,3,2025-06-21,7,Bureau schieten krijgen verenigen.
2594,35,5,2025-06-30,1,Weer spreken meest uitzoeken.
2595,53,3,2024-08-19,1.5,Beer mond verzameling kaars schaap eenheid.
2596,46,6,2023-07-24,4,Vijf miljoen steen liefde.
2597,130,2,2025-07-20,7.5,Werk oud koningin werelddeel zonnig.
2598,76,6,2026-02-09,1.5,Feest koning openlijk oog.
2599,55,7,2023-10-17,2.5,Plus leger ziel iets passeren.
2600,140,2,2023-03-27,3,Opeens andere avond bedreven overal iemand.
2601,114,4,2025-11-30,1.5,Ook nemen geen wereld.
2602,130,4,2024-08-01,3,Dood simpel noch kruis naast.
2603,118,7,2024-08-22,7.5,Dragen hand grijs wiel.
2604,8,8,2025-02-11,1.5,Haten straffen vreemd richting speciaal oost.
2605,113,5,2023-08-02,3.5,Dragen vullen keus tellen meubel.
2606,16,1,2025-10-16,8.5,Jaar naald winnen steun verkeerd beest.
2607,51,6,2024-01-21,1.5,Betalen stof maaltijd.
2608,14,5,2023-04-09,6,Passeren vraag verleden vergissen vast heel.
2609,15,7,2025-02-27,2.5,Eenheid pas vertrouwen vragen maaltijd weer.
2610,149,6,2025-11-07,6,Negen wachten gif horen boon glas.
2611,133,3,2023-04-02,2,Laten tafel dochter zullen.
2612,20,4,2024-03-29,7.5,Bot duwen fout anders neer iets.
2613,13,7,2025-10-11,2,Veroveren broek bijten genieten zonnig.
2614,87,1,2024-02-26,7,Vergelijken bij winnen huur activiteit vechten.
2615,52,7,2024-05-07,7.5,Rechts vierkant verkopen ontvangen verleden vergelijkbaar.
2616,13,3,2024-04-12,3.5,Maken bedekken hoe om laten.
2617,79,7,2023-10-18,6,Opeens gat toename blij verdienen.
2618,62,5,2026-03-14,7.5,Stoel nieuws al soms zeer.
2619,121,7,2025-04-18,7,Team resultaat einde.
2620,142,5,2025-02-11,3,Afval stoel buiten geluk opa.
2621,12,8,2026-05-14,1.5,Gerecht vertellen buurman.
2622,20,2,2023-09-21,7,Zon herfst provincie hoe buiten sorry.
2623,19,3,2023-08-25,2.5,Ontwikkelen schetsen horen.
2624,78,7,2026-01-04,3,Tuin verstoppen snelheid bang hoop voeden.
2625,85,5,2024-08-06,6.5,Fijn maal kopen vrij.
2626,116,4,2023-08-11,8,Miljoen kleden kost wachten bieden schetsen.
2627,60,3,2023-06-27,6.5,Sok kopen genieten jongen tussen belangrijk.
2628,140,2,2025-11-27,1.5,Plat nood zilver.
2629,113,3,2023-08-17,2,Blijven poort half repareren binnenkort.
2630,74,7,2023-06-21,8,Verwachten vast geloof mensen één.
2631,128,1,2025-01-29,4,Toename brood kleden genoeg zacht.
2632,63,6,2025-10-28,8,Bang controle mogelijk geloof mengsel lucht.
2633,46,6,2023-03-31,6,Nood land tas klasse.
2634,134,4,2024-05-28,2.5,Ijzer gereedschap druk.
2635,46,5,2023-04-26,4.5,Klas gevaarlijk bescherm.
2636,54,4,2025-11-01,1,Bezoek vork plank schouder zand.
2637,8,8,2024-11-18,7.5,Positie even niet vannacht wapen.
2638,86,3,2023-05-23,8,Verder bang kind bus eenzaam.
2639,16,2,2023-10-21,6.5,Noord cool zoals acht dansen laken.
2640,50,6,2023-05-14,4,Controle vertellen vinger gisteren gewoon.
2641,31,4,2025-01-28,1,Lopen neer oor orde.
2642,16,7,2023-01-13,4,Weer oog oog basis.
2643,11,2,2026-03-07,1,Kost schoon verwachten reeds park zelfde.
2644,112,5,2023-02-10,7.5,Ontbijt drinken niets.
2645,143,5,2025-03-03,4,Wij mogen tas vinden.
2646,140,3,2024-12-07,7.5,Brengen slaapkamer verenigen taxi nieuw.
2647,68,3,2025-07-19,6.5,Cool meubel lopen voor algemeen.
2648,113,5,2024-08-10,7,Uur zee zonder toen suiker.
2649,125,5,2023-11-25,3,Tellen tas auto hemel.
2650,120,4,2023-10-22,1.5,Oranje tafel vreemde moeten.
2651,63,7,2025-04-03,2.5,Normaal liegen stom zeer.
2652,131,8,2025-05-12,4.5,Stap fit groot map.
2653,99,6,2025-03-06,4.5,Verdienen boek snelheid.
2654,75,4,2025-03-27,2,Ademen waarom willen jagen mooi potlood.
2655,107,8,2024-01-27,6,Ziek eend cadeau conditie glad.
2656,109,5,2026-01-27,8.5,Ziek water beroep vernietigen.
2657,138,2,2024-03-13,4,Vorm peper speciaal kaars.
2658,89,7,2026-01-16,7.5,Conditie goed groente afval slapen.
2659,99,3,2023-04-15,2,Scherp vergissen grap oneven dochter kiezen.
2660,53,8,2025-02-26,6.5,Verhoging proberen bel meest.
2661,112,3,2023-02-18,7,Hert wreed water dat groeien woord.
2662,117,4,2024-07-13,7,Openlijk steen map.
2663,136,4,2023-11-05,4.5,Zoet vier onze even druk.
2664,93,1,2023-09-25,8.5,Zout verjaardag trein.
2665,24,1,2023-07-18,8,Hal glas voorkomen product.
2666,97,2,2023-01-18,8,Drijven boord netjes plaats.
2667,45,4,2024-10-03,3,Ei kleur leiden.
2668,106,6,2024-09-21,8,Fles map delen kop school.
2669,139,6,2026-04-09,8.5,Behalve welkom terwijl antwoord.
2670,29,3,2023-12-25,3.5,Terwijl geld vork laat cool.
2671,35,7,2023-11-08,2.5,Kans kruis nog antwoord ieder markeren.
2672,84,4,2023-11-21,6.5,Angst boerderij gemakkelijk hun tuin.
2673,128,2,2023-08-21,7,Alsjeblieft maal persoon.
2674,139,7,2023-03-22,2.5,Eerste terugkomst recht.
2675,106,8,2025-09-03,2,Doen breed noch klein.
2676,130,1,2026-04-12,6,Stilte mand bewolkt.
2677,99,2,2025-10-04,7.5,Mijn één als veer hoed.
2678,40,5,2025-01-27,1,Stilte tram zwembad breken.
2679,57,6,2025-03-17,2,Noot zuid bescherm vergelijken.
2680,103,8,2024-08-21,7,Geven gemeen begin zitten ver.
2681,50,6,2023-02-02,6.5,Hamer titel vriend echt.
2682,8,8,2024-06-01,2.5,Bloem koningin dat.
2683,74,5,2024-10-14,2,Fit openlijk stuk dan.
2684,99,1,2024-06-22,4.5,Op hemel veer.
2685,22,6,2024-07-12,7.5,Voetbal kist alleen rok lamp plastic.
2686,3,1,2026-02-03,1,Boek wat mama bieden maar.
2687,138,7,2024-09-11,4,Sok als ziekenhuis conditie.
2688,110,6,2025-03-06,1.5,Verandering kamer noch brengen avondeten.
2689,119,6,2025-01-21,8.5,Boven restaurant hoeveelheid.
2690,56,8,2023-09-29,3.5,Oorzaak verjaardag dragen leeuw voedsel zulke.
2691,131,2,2024-07-30,3,Stap uitleggen vogel gevangenis.
2692,6,3,2024-10-14,8,Leeg vloer zoals rok buurvrouw maan.
2693,52,6,2023-08-08,2,Vroeg mis goedkoop.
2694,26,2,2023-05-14,2,Gewicht mond gedrag vast offer.
2695,100,2,2023-01-20,7,Zingen breed antwoorden.
2696,97,2,2023-11-16,6.5,Plaat ons binnenkort heet.
2697,60,2,2023-09-07,1,Kosten stelen tante.
2698,1,7,2024-01-16,1,Koken zeer plastic vergelijkbaar.
2699,22,7,2024-04-22,2,Zo groen goedkoop leuk lip.
2700,139,4,2024-10-18,7,Modern bruikbaar onze.
2701,138,5,2025-10-11,6,Kuil gras eenheid smal achter berg.
2702,128,3,2026-04-27,8,En spelen schaar stil.
2703,52,4,2025-11-05,1,Kamer horen vloer.
2704,36,2,2024-06-23,2,Aanbod al normaal klaar.
2705,70,3,2024-01-21,2.5,Stilte zullen lopen ouder.
2706,120,5,2025-03-19,7.5,Aap munt ontmoeten terugkomst zwemmen buiten.
2707,101,4,2024-03-22,4.5,Kracht aanraken oor.
2708,85,3,2025-12-22,1.5,Klok structuur plattegrond.
2709,144,6,2023-05-13,1,Daarom mij werk stil.
2710,22,8,2023-05-04,6.5,Ring winnen ook lunch snel basis.
2711,94,6,2023-01-25,7,Nodig start heet.
2712,94,8,2023-05-15,6.5,Willen vierkant noot.
2713,108,8,2025-01-03,7.5,Zwemmen knippen bad alles overeenkomen verjaardag.
2714,93,4,2024-09-06,8.5,Morgen sap gereedschap bruiloft boete vergelijking.
2715,12,6,2024-04-12,6,Bijvoorbeeld boete voet hoeveel reizen.
2716,96,7,2025-04-19,4.5,Product school hotel dan ontwikkelen uitvinden.
2717,131,3,2025-08-07,8.5,Zien eerste gewoon.
2718,122,1,2023-10-18,7.5,Bescherm eten tamelijk.
2719,111,3,2023-10-13,8.5,Kunst anders hond wind.
2720,126,3,2025-03-29,3,Overleden groot voorkomen grappig koud licht.
2721,65,2,2023-11-06,6,Boerderij nul glimlach.
2722,45,5,2023-02-03,4.5,Vak slaapkamer nobel.
2723,145,7,2024-11-21,2,Scheiden dichtbij daar.
2724,70,4,2023-11-21,3.5,Moord overeenkomen te zeven.
2725,125,7,2025-09-23,6.5,Zeep koffie appel.
2726,103,2,2023-11-24,4,Mis best gif hoofd cool.
2727,87,3,2023-05-18,3.5,Toename kaas ziekenhuis kunnen.
2728,65,7,2024-04-26,6.5,Wonder gebeuren zus afname.
2729,47,6,2025-10-01,1.5,Blauw plaat zuid om.
2730,36,3,2024-09-28,7.5,Nummer huis normaal.
2731,109,3,2025-12-20,3.5,Wij plein titel zijn in.
2732,18,1,2025-01-26,6.5,Haan vierkant koningin.
2733,76,4,2025-07-04,3.5,Belangrijk pad fruit.
2734,93,8,2024-10-30,7,Leeftijd alles binnenkort oma.
2735,97,4,2024-07-28,6.5,Dapper blad blij vloer vroeg enkele.
2736,72,4,2023-09-18,3,Ons zou plattegrond.
2737,5,6,2025-09-27,6.5,Jas buurman recht.
2738,43,6,2025-11-12,1.5,Winter sneeuw activiteit steen.
2739,134,5,2023-06-16,6.5,Straffen gebied van voorzichtig waarom.
2740,56,5,2023-05-18,4.5,Hier spel ziekenhuis hemel.
2741,139,4,2023-10-21,3,Vork zitten ladder fris.
2742,96,6,2024-04-02,7,Kleur zes branden blazen.
2743,82,6,2025-09-15,6,Aarde minuut stilte plastic.
2744,55,2,2025-09-19,3,Zeker hert verleden gewoon.
2745,56,5,2024-08-28,7,Olie land mevrouw kruis draaien.
2746,123,1,2024-05-23,8.5,Succes storm buurvrouw luisteren woord.
2747,42,5,2024-09-02,3,Lopen aanval koffie ladder vader.
2748,22,6,2023-02-21,1.5,Wereld thuis woord verstoppen grijs.
2749,130,7,2025-08-10,8,Zacht plaats licht.
2750,93,2,2026-02-11,2.5,Verschrikkelijk licht versturen goedkoop plank.
2751,57,8,2024-07-14,4.5,Machine bijna dochter belangrijk falen afhangen.
2752,95,1,2024-08-06,2,Zijn brandstof moment mis meisje.
2753,140,6,2023-09-11,1.5,Zij buurman hij graf.
2754,8,7,2023-10-18,3.5,Herfst herfst laken stempel.
2755,96,1,2024-10-25,4,Noot wissen derde huur praten.
2756,149,1,2024-08-02,3,Papa straffen dood geven.
2757,19,3,2023-09-28,4,Afname kop schetsen uit.
2758,72,2,2023-11-07,1,Taxi bord slim.
2759,22,7,2025-01-07,3.5,Televisie noord bijna deel gereedschap vertellen.
2760,144,7,2024-12-04,8,Geen geboorte rook toen mis.
2761,116,3,2026-01-21,1.5,Uur speciaal neer groeien uit niets.
2762,63,8,2026-01-27,8,Kraam vierkant afspraak verliezen vangen.
2763,70,4,2023-11-22,1.5,Duur doen vloer.
2764,15,4,2023-04-26,7,Eis storm bijvoorbeeld spelen.
2765,67,4,2025-09-07,1,Verzameling bruiloft kort het.
2766,146,6,2023-11-09,8,Langs veer geloof dansen smaak prinses.
2767,5,5,2024-10-23,4.5,Kloppen zoon erg belofte schreeuwen bouwen.
2768,19,1,2025-10-05,1.5,Nul oud papa zak bijna.
2769,63,4,2024-02-14,6,Antwoorden af haten wie.
2770,102,2,2026-04-08,4,Geluid straat miljoen.
2771,116,4,2026-04-06,3,Opnemen maat raken.
2772,85,5,2023-11-08,6,Bed storm vogel suiker vogel.
2773,47,4,2026-02-13,3.5,Tafel wijn samen.
2774,96,5,2024-06-08,3,Zinken zou soms gewicht oorzaak grootmoeder.
2775,131,1,2025-03-15,1.5,Vechten horen kast achter bui.
2776,62,3,2025-07-01,6.5,Zand iemand idee doorzichtig.
2777,32,4,2023-08-19,1.5,Alleen wat olie.
2778,64,5,2024-02-14,8.5,Naast aanval daar machine tafel.
2779,70,5,2025-01-09,4,Machine winnen bouwen ander.
2780,92,1,2024-03-20,6,Brengen persoon zilver diep vork rood.
2781,98,4,2024-03-19,8,Populair klok meerdere televisie niet meneer.
2782,96,8,2025-10-20,7.5,Bad vloer olifant boven.
2783,143,8,2025-03-11,6,Duwen haan afgelopen.
2784,76,2,2026-02-22,6.5,Kat jij vies mis afgelopen radio.
2785,14,1,2023-08-08,1,Eiland team film komen.
2786,128,7,2024-07-15,1.5,Donker veilig koffer baan.
2787,15,6,2026-03-09,2,Pagina tand nummer verliezen gewoon.
2788,123,6,2024-03-16,7,Afval u ruimte kaars les schetsen.
2789,6,5,2023-06-05,3.5,Oom zoet wereld schouder.
2790,42,5,2023-03-13,1.5,Blij begrijpen brood.
2791,35,1,2025-07-24,8,Vorm veer knippen aap weg.
2792,33,2,2025-09-02,2,Elektrisch bedekken wild vals.
2793,82,1,2024-04-25,4.5,Taxi voorzien dik veroveren sex school.
2794,46,4,2026-02-27,4,Nieuws gebeuren correct nodig hallo berg.
2795,9,1,2023-05-14,4.5,Actief waar stempel.
2796,120,3,2025-10-15,4.5,Vader bewegen afhangen vertrekken bedekken boos.
2797,18,5,2023-01-28,6,Klas soep tand.
2798,60,5,2024-07-30,7.5,Zorgen schreeuwen koud trekken gedragen vies.
2799,55,4,2023-02-19,7.5,Verzamelen geel nu bodem hoog vast.
2800,13,7,2025-07-06,8,Waar lamp team dier.
2801,71,1,2026-02-18,7.5,Vast opeens langzaam zee hoewel genoeg.
2802,108,8,2024-08-09,3,Hoewel tante vet correct tegen.
2803,109,6,2025-08-25,6,Vroeg hotel boon gehoorzamen kijken.
2804,95,6,2026-02-02,6,Min boon kantoor diep verstand prijs.
2805,109,8,2025-04-13,2.5,Maal gebruik klimmen dienen titel leren.
2806,43,8,2024-12-12,8.5,Teken lang maaltijd dan kaas.
2807,125,2,2026-01-15,4.5,Bord maag bellen mis bureau.
2808,98,6,2026-05-18,3,Uitzoeken studie meer zullen structuur.
2809,12,6,2025-08-13,4,Rennen bellen boom hoeveel zitten nek.
2810,100,3,2025-11-03,8,Voor hart beter helder.
2811,116,2,2026-03-20,2,Sinds rijst klimmen dom drijven.
2812,31,1,2025-05-08,1,Tegen kom neer zoeken.
2813,70,6,2024-06-05,6,Één munt heet bed lach.
2814,109,7,2025-09-28,1.5,Correct lijk voorzien samen.
2815,67,6,2025-12-07,7.5,Medicijn beroep vergelijken.
2816,68,8,2025-04-15,7,Wind familie normaal warm.
2817,1,2,2023-11-15,8,Lachen daarom pan fout negen soort.
2818,91,4,2025-10-11,2,Partner kracht rijst angst gisteren want.
2819,28,4,2025-04-11,3,Zulke orde geen beide huren keus.
2820,88,2,2023-02-18,1,Gewoon instrument alsjeblieft nat.
2821,19,5,2024-02-29,2,Tekenen map ook stil zacht hoop.
2822,104,7,2025-07-15,1.5,Leeuw gevolg acht effect rechts.
2823,100,7,2023-01-22,7.5,Kunnen beide manier overal maan.
2824,124,8,2025-02-06,2.5,Ik dit vers open verzamelen.
2825,10,8,2026-04-30,1.5,Verenigen natuurlijk deken dus.
2826,78,8,2024-10-16,3,Verwachten storm comfortabel spreken.
2827,123,6,2025-02-24,8,Bel droog wind deken.
2828,11,8,2025-10-01,1.5,Boven bewolkt maand.
2829,27,2,2023-06-27,4.5,Radio meubel park zeven boven.
2830,132,7,2024-05-17,7,Beide hand piano nog.
2831,10,6,2024-11-21,2.5,Haast vergeven koud.
2832,65,7,2024-09-26,6.5,Geel kip wijn vergelijking zaak aardig.
2833,9,8,2023-07-14,1,Versturen dun anders dus laag zeer.
2834,134,5,2023-05-22,6,Trekken af zwaar voorkomen een koningin.
2835,77,2,2026-03-03,4,Verder belangrijk noord vijand list voetbal.
2836,131,5,2025-11-24,4,Wassen uur bijna.
2837,97,7,2023-11-30,1.5,Lijk terugkomst voor schaap.
2838,21,4,2023-08-13,7,Half elk een.
2839,2,7,2025-09-14,4,Echt wakker klaar gebeurtenis broer.
2840,13,5,2023-12-28,8.5,Dochter groen liegen zitten wachten.
2841,144,4,2024-01-10,2.5,Nobel zak antwoorden.
2842,29,3,2025-06-29,8,Succes hoog belangrijk voedsel persoon.
2843,127,8,2023-10-13,2,Vanmorgen nul brandstof pan stempel gebied.
